solution,k,persona_id,persona_nome_auto,rank,doc_id,chunk_id,evidence_score,excerpt,projeto,pais,marca_foco,publico,tipo_sessao
macro_k3,3,macro_k3_p00,Cuidadora Consciente,1,doc_b71f944ee9bec4b0,doc_b71f944ee9bec4b0_pp_ch_0016,23.35,"Ela sabe. Meninas, me fala uma coisa, o que mais que tem de benefício em usar todo dia, nos produtos todo dia? Mais alguma coisa, Melissa, tem mais algum benefício, mais algum benefício? O todo dia ele é probiótico, ele se adapta bem à pele, a todo tipo de pele, é assim, mas eu procuro sempre Falar para o cliente. Eu dou dicas ao cliente. Quando o macadama é mesmo, o macadama é o nospecan. Se a pele for pouco mais ressecada, então é ele. Então, se você não tem uma pele muito ressecada, é o algodão, flor de lixa, mas mesmo a fragrância parece que assim, as fragrâncias mais suaves parece que eles para peles que...",radiosa,nao_inferido,nao_inferido,nao_inferido,nao_inferido
macro_k3,3,macro_k3_p00,Cuidadora Consciente,2,doc_66b40b2eb6436092,doc_66b40b2eb6436092_pp_ch_0006,23.35,"Por isso, nos especializamos em perfumaria e cuidados masculinos para possibilitar que cada homem se expresse e se cuide da sua maneira. Unindo ciência com natureza, desenvolvemos vasto portfólio de produtos. Na perfumaria temos fragrâncias surpreendentes com ampla diversidade olfativa para as mais diferentes ocasiões masculinidades. Em cuidados pessoais, uma linha completa para pele, barba e cabelo, com alta performance e resultados cientificamente comprovados. Então esse texto aqui a gente nem vê normalmente na vida real, é só para vocês saberem o que ela está propondo. Então é muito essa coisa de cuidado com...",jack_pearson,brasil,nao_inferido,nao_inferido,nao_inferido
macro_k3,3,macro_k3_p00,Cuidadora Consciente,3,doc_bc29e08f3450ea98,doc_bc29e08f3450ea98_pp_ch_0027,21.35,"Então a sensação é de bem-estar? Sim. Sim, de bem-estar e disso, de ver a pele uniforme mesmo. Cheila, você voltou, que bom! Estava falando do olhar e daí a gente já foi para outra história, menina, já vou pular aqui. A gente tá falando das partes do corpo, pele do corpo, assim, quais são, como é que é a relação com a pele do corpo, quais são as partes que mais gostam e por que gostam, quais são as partes que menos gostam e por que não gostam, como que é isso? Que eu mais gosto o meu rosto. As pessoas costumam falar, ai, você tem uma pele boa, que rosto, que bonita a sua pele, do seu rosto. Então, por conta...",radiosa,nao_inferido,nao_inferido,nao_inferido,nao_inferido
macro_k3,3,macro_k3_p00,Cuidadora Consciente,4,doc_c3440e03873d8788,doc_c3440e03873d8788_pp_ch_0060,19.35,"Eu gosto do cheiro do Ecus, o de Angiroba é uma delícia. Maracujá. Então assim, em termos de cheiro, o forminho, açaria, tanto no Ecus, Tanto não, todo dia. Então, já fica aí você que depois eu quero que as outras me falem. Tem uma pergunta pra agregar aí. Essa linha pra pele negra, cuidados com pele negra, que ingredientes, gente, a gente acha que deveria ter pra quem entrega isso que a gente tá buscando? Tem algum ingrediente que a gente falar, esses ingredientes seriam bem legais? Rosa mosquita, com certeza. Eu acho que... Eu acho que a manteiga de cacau. Hidrata também muito a nossa boca, né? Eu acho que...",radiosa,nao_inferido,nao_inferido,nao_inferido,nao_inferido
macro_k3,3,macro_k3_p00,Cuidadora Consciente,5,doc_a0b281c2785ae1ed,doc_a0b281c2785ae1ed_pp_ch_0018,18.35,"Ótimo. E a Cláudia? Então, de beleza, eu acho a Cristiana, que a colega até citou, eu acho ela espetáculo. Cabelo, corpo, pé e também a forma como ela fala também é muito elegante também. Eu acho que é espetáculo, é uma negra maravilhosa. Ó, Tódia, fica com o microfone aberto então que eu vou começar com você. Me fala uma coisa, que é pra todas, né? Eu quero saber se vocês procuram, buscam informação sobre cuidado com a pele. Se sim, onde? Se não, também quero entender por quê. Como que é isso? Eu procuro sim, eu procuro principalmente internet, vídeos de YouTube, desenha, skin care, eu sempre procuro,...",radiosa,nao_inferido,nao_inferido,nao_inferido,nao_inferido
macro_k3,3,macro_k3_p00,Cuidadora Consciente,6,doc_ecbea0911b71e6fa,doc_ecbea0911b71e6fa_pp_ch_0015,17.35,"Beleza! Quem mais você vai me falar? Eu quero que as outras me contem. Eu acho que essas coisas são as três coisas que eu mais procuro no meu corpo. Tá bom, Ju, obrigada. Agora a outra Ju quer falar também. Fala, Ju, quais são as suas principais preocupações e necessidades envolvendo o corpo, a pele do corpo? Sim, eu gosto de usar por conta da hidratação, né? E do cheiro. Eu acho que o perfume conta muito, né? O hidratante que eu uso mesmo, ele é muito cheiroso. Pode falar nome e marca, tá, gente? Pra eu saber também. É o da Paixão. Na paixão, pelo cheiro. E em termos de hidratação, o que é importante em termos...",radiosa,nao_inferido,nao_inferido,nao_inferido,nao_inferido
macro_k3,3,macro_k3_p00,Cuidadora Consciente,7,doc_d61537ccd540a8ec,doc_d61537ccd540a8ec_pp_ch_0024,16.35,"Palavras, gente, que palavras que a gente pode usar aí para descrever essa propaganda? Pode ser clichê e colocar natureza? Pode, pode ser o que você quiser. Oi, Jenny. Natureza. Janaína? Me traz refrescância. Refrescância. Mariana? Eu também vou natureza. Natureza. Ana Paula? Eu ia colocar natureza, mas vou pensar alguma outra, pode passar para outra pessoa. Hidratação, rejuvenescimento. Lembrou de alguma, Ana? Então, antes se nós, já que falou na própria propaganda. Eu vou passar mais uma e a gente vai conversar sobre ela, tá bom? Todo mundo bem? E aí, quem quer comentar esse? Posso começar? Fala, Mari. É uma...",rosacea,brasil,nao_inferido,nao_inferido,nao_inferido
macro_k3,3,macro_k3_p00,Cuidadora Consciente,8,doc_c81de68b7ac9189d,doc_c81de68b7ac9189d_pp_ch_0044,16.35,"Bom, essa é uma base que eu quero muito comprar porque é duração de 24 horas e isso já me pega. Todo produto que tem algum tipo de prazo chama muita atenção, porque instiga o consumidor a testar. E em relação à tecnologia de oxigênio da pele, isso é exatamente muito importante pelo que a Caroline e a Gabriela falaram. De deixar a pele respirar. Normalmente, nós temos bases muito grossas, né? Essas bases mates que a gente usa são muito grossas, né? Então, parece que a gente tá com reboco no rosto todo santo dia. E, assim, vendo a imagem, eu tenho a impressão de ser uma base com uma textura bem fina e que se...",rosacea,brasil,natura,nao_inferido,nao_inferido
macro_k3,3,macro_k3_p00,Cuidadora Consciente,9,doc_b71f944ee9bec4b0,doc_b71f944ee9bec4b0_pp_ch_0012,16.35,"Normalmente são os mesmos clientes que compram o todo dia. Qual a diferença que você vê? O ECOS é só óleo ou tem hidratante também? Ecos tem óleo também, trifásico, tem duas fases. É só óleo ou tem hidratante também? Tem hidratante também. Mas vende mais o óleo ou o hidratante? Ou os dois vendem bastante? A Ecos vende mais o hidratante, eu pelo menos a mais hidratante. Não tanto. Tá, vende menos que todo dia, eu entendi, né? Agora, qual a diferença, gente, que vocês acham? Agora eu quero todas falando. Qual a diferença que tem da linha Todo Dia pra linha Ecos? Fala, Melissa. Deixa a Melissa, depois você fala, só...",radiosa,nao_inferido,nao_inferido,nao_inferido,nao_inferido
macro_k3,3,macro_k3_p00,Cuidadora Consciente,10,doc_bc29e08f3450ea98,doc_bc29e08f3450ea98_pp_ch_0058,15.35,"Então, assim, tem que mostrar a realidade, porque daí sim a pessoa sente representada. Como que a gente quer que essa realidade seja mostrada? Abra dos microfones, as outras também querem saber. Corpo real, corpo real, uma mulher acima do peso, mas que não tem vergonha do corpo, que ela mostre lá a sua célula lítica, ela mostra lá que ela tem uma marca no bumbum, que ela tem uma estria, que ela tem... O cutucelo tá pouco mais escurecido, que a pele tá ressecada e que aí ela passou o hidratante, o antes e o depois do hidratante. Essa é a realidade. Não mostrar algo... A gente vê muito isso em comercial de produto...",radiosa,nao_inferido,nao_inferido,nao_inferido,nao_inferido
macro_k3,3,macro_k3_p01,Comparadora Omnicanal,1,doc_012fe174842b390e,doc_012fe174842b390e_pp_ch_0012,47.35,"É difícil. Você acha que o boticário ajuda muito a vender? O que a Natura faz que ajuda a vender? O que a Cacau Show faz que ajuda muito a vender? A boticário, em venda, se eu me dedicasse, eu venderia muito mais boticário. Porque ainda é discriminado a Natura. Acha que o boticário é melhor. Ainda tem uma discriminação. O cliente acha que o Boticário costuma ser melhor. Mas não é porque assim em relação a hidratantes os hidratantes da natura eles hidratam muito bem enquanto o da Boticário só é perfume só o cheiro não hidrata. O que mais que tem a ver com você? Como que eles caracterizam essa discriminação, essa...",natura_3cs,nao_inferido,natura,consultoras,nao_inferido
macro_k3,3,macro_k3_p01,Comparadora Omnicanal,2,doc_0e16de972b72d565,doc_0e16de972b72d565_pp_ch_0018,42.35,"Então ela já tem na loja a maior parte e aí você compra em estoque, é isso? Isso. Aí quando ela não tem, ela só me passa a revista e eu compro. Tá, entendi. Quero falar então pouco, você falou também do Natura, né? Que é uma coisa que você compra e que dona Natura é sempre no virtual, é isso? Isso. E na loja dela, não compro também pelo marketplace. Uma vez eu também comprei pela Shopping, o perfume tinha outro cheiro, O que você quer dizer na loja da Natura? Você quer dizer isso? No caso da Natura, você tem revendedora ou não? Não. Eu sei que tem revista, mas eu sempre compro na loja virtual por conta do valor....",compras_digitais,nao_inferido,nao_inferido,nao_inferido,nao_inferido
macro_k3,3,macro_k3_p01,Comparadora Omnicanal,3,doc_7c1dc7dcc6ddc2d7,doc_7c1dc7dcc6ddc2d7_pp_ch_0029,28.35,"Para a gente ir fechando então, menino, para eu liberar vocês. Estão fazendo meio que wrap-up, fechamento de tudo que vocês viram. Como que vocês, mais alguma coisa que vocês acrescentariam entre a oferta de Natura versus a oferta da concorrência, pensando no que a Natura oferece atualmente, o que vocês veriam como aprimoramento, se tiver algo além do que vocês trouxeram. Será que a gente lembra a mesma coisa? Eu acho que entre as entrevistas com consumidor, consultora, para mim fica muito claro que é mais preferência e amor de marca, né? Agora o que me chocou mais mesmo foi a questão das lojas, eu acho as lojas...",3cs_perfumes,nao_inferido,nao_inferido,nao_inferido,entrevista_em_profundidade
macro_k3,3,macro_k3_p01,Comparadora Omnicanal,4,doc_761f127ebf5926ab,doc_761f127ebf5926ab_pp_ch_0013,27.35,"É. E elas nem podem vender Avon, né? Porque ainda não existe uma loja física. Apesar delas virarem construtora Avon agora, porque toda construtora Natura é construtora Avon, não existe formato de loja física. E ela quer abrir uma nova. Ela tem o plano de abrir uma nova loja em outra localidade, porque Esse lugar que a gente foi é lugar bem classe AB, assim, sabe? E ela acha que talvez classe CD, que ela falou BC, fizesse mais sentido, mais rotatividade. Ela não falou nada versus o Boticário, assim, de produto. Ela também não trouxe nada de... Mas eles acham que o Boticário tem uma comunicação melhor. Que, por...",3cs_perfumes,nao_inferido,nao_inferido,nao_inferido,entrevista_em_profundidade
macro_k3,3,macro_k3_p01,Comparadora Omnicanal,5,doc_c8cb62c97a6b1133,doc_c8cb62c97a6b1133_pp_ch_0025,27.35,"É, chama atenção, gente. Tá tudo gritando. E aí eu senti que ela só foi na loja da Natura porque a mãe dela já tinha esse apego com a Natura, tá? Mesmo entrando no shopping com esse direcionamento, ela ainda para na frente da loja do Boticário porque chama a atenção. E você sabe, Carol, o que está por trás desse apego? O que gera desejo natura? Por que ela se conecta, ela e a mãe, com a marca? O que ela trouxe pra gente, que a gente foi perguntando, é que a mãe dela, na verdade, sempre usou Natura. Então, em algum momento, ela ganhou de presente Natura, pelo que ela comprou. E aí, hoje, ela vê valor na marca...",natura_3cs,nao_inferido,natura,nao_inferido,nao_inferido
macro_k3,3,macro_k3_p01,Comparadora Omnicanal,6,doc_cc7b48f0bda6f359,doc_cc7b48f0bda6f359_pp_ch_0036,24.35,"Então, assim, eu sei que talvez você nunca tenha parado para pensar nisso, mas vamos pensar aqui juntas. O catálogo que você recebeu era aquele virtual que você consegue também jogar para o carrinho? Ai, eu não lembro. Não lembro, porque eu não fiz essa parte, eu fiquei só olhando as coisas mesmo. E aí eu olhei tudo, fechei e ela me mandou uma mensagem. E aí você escolheu o que você vai querer? Eu falei, olha, eu quero uma caixa de sabonete de macadamia e hidratante de macadamia, que inclusive eu tenho até ele aqui. O sabonete já acabou, mas o hidratante ainda tem. Então tá bom. Bom, eu vou mostrar aqui pra você...",compras_digitais,nao_inferido,nao_inferido,nao_inferido,nao_inferido
macro_k3,3,macro_k3_p01,Comparadora Omnicanal,7,doc_5c06d290f301eadb,doc_5c06d290f301eadb_pp_ch_0007,23.35,"Aí se você quiser, cê tem que ir num outro código, pagar por elas, pra você poder ter uma sacola da Natura. E o Boticário já não é assim. O Boticário, todo pedido, ele te manda a sacola, independente de você pedir ou não. Então, isso facilita muito a vida. Você não paga. Não paga. E da Natura, você paga ou não paga? Sim, paga. Paga. Eu, às vezes, preciso ter porque muita gente pede presente. Eu não posso dar produto da Natura numa sacola do Boticário, né? E aí, às vezes, eu não tenho sacola aqui, porque é ruim de você comprar, às vezes, não tem estoque que você quer e também não é barato. E eu acho que eles...",natura_3cs,nao_inferido,natura,consultoras,nao_inferido
macro_k3,3,macro_k3_p01,Comparadora Omnicanal,8,doc_5c06d290f301eadb,doc_5c06d290f301eadb_pp_ch_0004,22.35,"Interessante. Então você já faz entrega até com... Já tem uma pessoa que te apoia ali, pelo menos, pras entregas, quando não tá dentro do seu [ENDERECO]. É, na verdade, eu faço pelo Lalamu. Complicativo. Eu tenho cliente até no Morumbi, enfim, que não é só... Tudo cliente de pandemia, sabe? Sim. Foram compartilhando, e aí chegaram até mim. E quando... E essas, assim, às vezes nem é porque eu mandei nada, porque já sabe o produto quer, já a quantidade, já me manda mensagem, já quer tal, tal. E hoje você trabalha só com a Natura ou você já trabalha com outras marcas? Eu já cheguei a trabalhar com a Natura,...",natura_3cs,nao_inferido,natura,consultoras,nao_inferido
macro_k3,3,macro_k3_p01,Comparadora Omnicanal,9,doc_7c1dc7dcc6ddc2d7,doc_7c1dc7dcc6ddc2d7_pp_ch_0004,22.35,"Eu acho que a vitrine, tanto a luz, que a Má estava falando, mas também a escolha. O Boticário tinha o lançamento grande e era de perfumaria, então o 214 estava nas duas lojas, como vitrine, com uma exposição grande. Mesmo que as duas tinham diferença entre as lojas do Boticário, de tamanho, de escolha, a gente conta mais daqui a pouco, mas assim, uma escolha clara de perfumaria na vitrine existia nas duas. Na Natura tinha quase por de fora inteiro na vitrine, daí nem dava para ver qual era o lançamento, apesar de ter alguns lançamentos na vitrine, não tinha nenhum deles com destaque, então... Isso a gente viu...",3cs_perfumes,nao_inferido,nao_inferido,nao_inferido,entrevista_em_profundidade
macro_k3,3,macro_k3_p01,Comparadora Omnicanal,10,doc_f17a8b4e6ffe8287,doc_f17a8b4e6ffe8287_pp_ch_0002,21.35,"Tá começando agora, eu tenho que tem 20 já. Nossa, menina, mas você tá jovem, hein? Eu tive ele bem nova, aí eu tive três, só que com espaço bem grande, então ele tem 20, tem de 13 e de 5. Ai, que delícia. Em casa nós somos três, também é bom ter bastante irmão, a gente se apoia bastante, né? É, é uma baguncinha, mas é bom. É, é uma bagunça. Pra mim, realmente, minha mãe ficava maluca. Mas que bom. Então, você trabalha como revendedora só de Natura, é isso? Não, não. Eu revendo outras marcas também. Outras marcas também? Pode falar ou não? Pode, preciso que fale. Eu revendo Eudora, Boticário, Natura e Avon, às...",natura_3cs,nao_inferido,natura,consultoras,nao_inferido
macro_k3,3,macro_k3_p02,Compradora Social e Presenteadora,1,doc_cda5ac0ca4bfa447,doc_cda5ac0ca4bfa447_pp_ch_0023,14.35,"Então, é uma loja que fica aqui na Brigadeiro, com a Paulista, já é uma loja bem antiga, aqui na região, e é uma loja que eu já fui algumas vezes até pra comprar presente pra minha sogra, pra minha mãe, né? Que é aquela da Bíblia, pra minhas tias também. E é uma loja assim, que ela tem é uma loja só de roupa feminina e tem tanto assim roupa pra mulheres mais maduras quanto mulheres mais jovens, não tão jovens, né? Acho que uma mulher de perfil de uns trinta anos pra cima, né? Até que uma mulher que gosta de uma roupa assim pouco mais descontraída, uma mulher que trabalha num ambiente de escritório como eu, então...",natura_3cs,nao_inferido,natura,consumidoras,nao_inferido
macro_k3,3,macro_k3_p02,Compradora Social e Presenteadora,2,doc_d16712b5a3350889,doc_d16712b5a3350889_pp_ch_0022,14.35,"Os produtos. A revista interativa tem essa... É mais parecido com o que era a revista mesmo, que você consegue abrir e ver as imagens dos produtos. Tem mais alguma coisa que te incomoda nesse, que você vê e acha que o da revista é mais interessante para você? Pela primeira vez, o que me chamou mais atenção foi isso. Mais esse aspecto visual de trazer as coisas como numa revista mesmo. Se deixasse de existir a revista, por exemplo, e você tivesse que passar a comprar através desse, você sentiria a falta da revista que você vê lá, que lá você consegue ver as páginas da revista? Isso é algo que você também...",compras_digitais,nao_inferido,nao_inferido,nao_inferido,nao_inferido
macro_k3,3,macro_k3_p02,Compradora Social e Presenteadora,3,doc_89fa2004a39f9cde,doc_89fa2004a39f9cde_pp_ch_0009,12.35,"Tem marcas, mas marcas, assim, é voltada a pessoas específicas, por exemplo. Eu tenho amigos que eu sei que amam Calvin Klein, amam Kelvin e tudo mais. Se é pra dar pra amigo, eu sei que eu vou procurar mais nessas lojas. Se é pra dar pra minha mãe, eu sei que minha mãe ama bolsa, sapatos, aí eu vou procurar nessas outras lojas. Se eu estou passeando numa loja departamento, eu gosto muito de passar na Renner, que a Renner tem de tudo também. Lá eu sempre, quando eu quero dar presente para mais de uma pessoa, eu sempre, às vezes não, sempre encontro alguma coisa interessante. Dependendo se vier, assim, depende da...",natura_3cs,nao_inferido,natura,consumidoras,nao_inferido
macro_k3,3,macro_k3_p02,Compradora Social e Presenteadora,4,doc_27d3eb4bf6306e35,doc_27d3eb4bf6306e35_pp_ch_0014,11.35,"Então, ela foi em algumas lojas, né? E aí ela tinha me falado, ai, me ajuda a procurar na internet e tudo mais. Eu fui procurando. Eu falei, me fala o que você quer, como você gosta, que eu vou procurar baseado nisso, né? E aí ela me falou como ela queria. Procurei na internet, só que assim, na internet é ruim, você não consegue ver e tudo mais. E ali no [ENDERECO], tem bastante lojas de móveis, né? E tem uma lá muito antiga que ela já comprou outras coisas, é uma loja de uma família lá, que tem coisas muito boas. E ela tinha falado, eu gostei dessas, mas essa tá muito cara. Aí ela achou uma outra parecida, Só...",natura_3cs,nao_inferido,natura,consumidoras,nao_inferido
macro_k3,3,macro_k3_p02,Compradora Social e Presenteadora,5,doc_399dacb2736f0f29,doc_399dacb2736f0f29_pp_ch_0014,10.35,"E você falou das amigas, né? Conta pouquinho. Elas também são importantes? São, muito, né? Porque por mais que tenha a minha sogra e a minha mãe, elas também tem a vida dela, né? E a minha sogra tem outros filhos. Minhas mães são pequenas, né? Eu tenho punhado de nove anos. Então, né? Acaba demandando. E as minhas a gente tem a mesma fase de idade, de [IDADE] anos, então é tudo muito novo, é tudo muito que fofinho, vem cá, vamos ficar com a titia, vamos ali no parquinho com a titia, vamos passear, então é muito importante, acaba sendo importante para gente também, porque eu vejo muitas mães que ficam muito tempo...",bem_maes,nao_inferido,nao_inferido,nao_inferido,nao_inferido
macro_k3,3,macro_k3_p02,Compradora Social e Presenteadora,6,doc_cfb49b86362bd118,doc_cfb49b86362bd118_pp_ch_0014,9.35,"E você costuma comprar onde? Agora que eu tô aqui, na verdade, até antes de morar em São Paulo, aqui mais perto, eu sempre fui no Shopping Eldorado, porque eu sei que lá tem todas as lojas possíveis, assim. Então, eu acho que é no Pátio Paulista aqui, também perto. Eu gosto de ter várias opções. É isso, basicamente. E não as de sempre, sabe? Eu gosto de shopping que tem tudo, assim. Tudo que eu quiser. Tipo, tem marcas, mas... É que geralmente não tem alguns outros shoppings, é porque tem shopping pequeno, tem shopping grande, né? Então, vai, por exemplo, quando eu vou comprar pra mim, tem lugar, tem uma loja...",natura_3cs,nao_inferido,natura,consumidoras,nao_inferido
macro_k3,3,macro_k3_p02,Compradora Social e Presenteadora,7,doc_89fa2004a39f9cde,doc_89fa2004a39f9cde_pp_ch_0003,9.35,"Minha mãe mora no litoral, aqui de São Paulo, em Itanhaém. Os meus avós moram lá também, eles foram para ficar pertinho e fugir da correria, eu ainda não quero fugir, eu [ENDERECO], então por isso que eu moro no centro, inclusive, para editação e tudo mais, sempre quando dá para sair eu estou saindo para uma paladinha, para barzinho, eu gosto de estar cheio de amigos por perto, não gosto de estar sozinho, sou uma pessoa muito sociável, se eu estou sozinho eu fico até deprimido, e aí no encontro disso eu gosto ver as pessoas que estão comigo felizes também, não adianta só eu estar alegre lá Eu sou aquele tipo de...",natura_3cs,nao_inferido,natura,consumidoras,nao_inferido
macro_k3,3,macro_k3_p02,Compradora Social e Presenteadora,8,doc_813751e4679e395b,doc_813751e4679e395b_pp_ch_0034,9.35,"Sim, porque eu tava lá, eu ainda tava morando para aqueles lados daquela região. Então era super perto, passei ali. Vocês acham que a primeira vez tem que ser numa loja, por exemplo? É bom porque você eles explicam, né? Igual as minhas falaram, ela explica que a a a embalagem você pode plantar, ela vira adubo, enfim, eu acho que a primeira vez ela cai na loja, sim. Eu que eu compro muito na loja. Então, pra mim, Eu uso muita coisa da Natura. E eu, geralmente, eu gosto de ir à loja. Eu não sou muito fã de comprar. Eu gosto de sentir cheiros. Eu gosto muito de comprar. É, a não ser que eu conheça há muito tempo....",biome,nao_inferido,nao_inferido,nao_inferido,nao_inferido
macro_k3,3,macro_k3_p02,Compradora Social e Presenteadora,9,doc_96b165a2a6f7a32d,doc_96b165a2a6f7a32d_pp_ch_0019,9.35,"Não, não tem mais nada não, acho que é só isso. Você sabe se a Natura tem revista interativa? Sei não. Essa que você recebe, você consegue mexendo nela? Porque você disse que marca num papel, né? Eu não sei não, se tem interativa. Porque eu gosto do negócio de comprar na pessoa. Às vezes é até mais barato em sítio. Eu não sei quem desconto, mas eu gosto. Às vezes é desconto tão invisório. E ela é tão simples, leva na minha casa. Às vezes faz pacote pra presente. Ela que leva na tua casa quando você encomenda? Às vezes sim, às vezes quando eu tô com tempo eu pego, geralmente é o porteiro que recebe. E aí ela faz...",compras_digitais,nao_inferido,nao_inferido,nao_inferido,nao_inferido
macro_k3,3,macro_k3_p02,Compradora Social e Presenteadora,10,doc_fcc334ae6da3d7f2,doc_fcc334ae6da3d7f2_pp_ch_0002,9.35,"Vamos começando, e aí se ela entrar, ela complementa, para não te prender aqui muito também, e eu também tenho mais uma em seguida. Então, a gente se mantém dentro desse prazo aí até cinco e meio. Flávia, não me apresentei, eu sou a [NOME], eu estou aqui representando a Kira, que é o Instituto de Pesquisa que está conduzindo esse projeto. E a ideia, como eu falei, é a gente trazer e fazer esse download das informações de todas as vivências que vocês tiveram nas últimas semanas, né? E para auxiliar, eu vou trazer em etapas, e aí eu acho que tem funcionado contar realmente de uma forma mais livre, e aí eu vou...",3cs_perfumes,nao_inferido,nao_inferido,nao_inferido,entrevista_em_profundidade
