cluster_label,auto_label,rank,similarity_to_cluster_centroid,chunk_id,doc_id,excerpt,projeto,publico,marca_foco,tipo_sessao
km_012,tecnologia / bio / bioeficiente / produto,4,0.6784495711326599,doc_3a9c3f93806290fb_pp_ch_0039,doc_3a9c3f93806290fb,"Muito bom. Ótimo. E aí vou pegar outra sugestão, que é o Dermoplus. O que vocês acham desse nome, Dermoplus? É pouco a brincadeira aí de juntar os prefixos e prefixos aí, né? Dermoplus. Passa o quê? Ou Dermomais? Eu gostei da tecnologia, mas para mim vem mais a questão de produto para o rosto, especificamente. Dermoplus ou Dermotec? O Dermoplus. Seria Dermoplus mesmo, não seria nem Dermomais. Dermoplus. Tá bom. Para rosto. O dermo tem uma tendência a focar pouco na coisa da pele, né? Eu ia até falar, provocar vocês nesse sentido, né? Realmente, o que o Gabriel falou, tipo, dermo plus, parando para pensar, realmente parece que é algo mais voltado para o rosto, para a pele do rosto, assim, que é uma pele mais, pouco mais sensível, tipo, uma pele que, assim, muitas pessoas têm pele oleosa, seria algo muito relacionado para a pele do rosto, dermo plus. Gente, eu vou escolher dois nomes e eu vou colocar mais aí que eu tenho que avaliar com vocês que estava entre os piores, tá? Então eu vou ",jack_pearson,nao_inferido,nao_inferido,nao_inferido
km_012,tecnologia / bio / bioeficiente / produto,5,0.6766020059585571,doc_66b40b2eb6436092_pp_ch_0029,doc_66b40b2eb6436092,"E entre Dermotech e bioinovação, qual delas vocês acham que diferencia a fila para homem das outras marcas para homem no mercado? Qual delas que dá uma diferenciação mesmo, sabe? Que você fala, nossa, isso é pouco, isso é diferente. Dermotech mesmo. Eu acho que o Dermotech traz a sensação de inovação, de algo diferente. Algo diferente. Muito bom. Mas o que eu entendi é que o problema do DERMA-PR é o fato de que ele não vai pra linha toda, né? Ele fica mais na... Ele restringe pouco a produtos relacionados a cuidado com a pele. Então tá bom, gente. Bom, teve nome que surgiu na outra reunião. Queria ver se vocês acham esse nome interessante. Vou até parar aqui só para vocês. Que é biotec. Ao invés dermotec, que fica restrito à pele, e se fosse biotec? O que vem na cabeça quando pensa em biotec? Algo tecnológico natural. Algo tecnológico e natural. Mas é bom isso? E os outros? É Biotec ao invés de falar dermotec. Eu gosto. Me soa agradável. Me soa popular. Me soa bem simples direto. Eu ac",jack_pearson,nao_inferido,nao_inferido,nao_inferido
km_013,revista / compra / site / comprar,1,0.6508944630622864,doc_76c629289d2e414c_pp_ch_0023,doc_76c629289d2e414c,"Aí embaixo sim aparece outros nomes se eu for entrar se aparece assim aí aparece outro nome de outra pessoa daí eu já digo aí não me manda teu link. Tá você sabe se você entrar aqui pela minha conta se vai direto para. Ela não vai não não sei Na verdade não entrei, não entrei. Eu sempre, como eu entro por ela, aí por exemplo, quando eu vou finalizar uma compra, pede para eu me logar, isso sim, mas eu nunca entrei, porque já como no meu computador já está tudo cadastrado, enfim, eu já abro o link direto. Entendi. E às vezes ela te manda direto essa página, é isso? Sim, ou só do produto, assim da sacolinha não, do produto em si, como se eu tivesse pesquisado ele. Mostra o produto como se você tivesse pesquisado. Isso, dela perguntar esse mesmo, sim. Ela te manda isso e ela confirma com você se era esse mesmo? É isso? Olhando assim, era mais ou menos essa a impressão que você tinha? Trouxe alguma coisa de novo assim? O que você me falaria? Não, é assim mesmo a página. Eu acho uma página q",compras_digitais,nao_inferido,nao_inferido,nao_inferido
km_013,revista / compra / site / comprar,2,0.6275507807731628,doc_d16712b5a3350889_pp_ch_0012,doc_d16712b5a3350889,"Aí do link você já tem a opção ali de mandar direto pra consultora? Isso. Eu já pago por ali, e depois eu recebo em casa. Do discriminadinho ali, os códigos, os produtos que eu quero, a quantidade. Você me falou que recebe pelos correios, né? Aí como fica o frete? Você paga pelo frete? Ou é frete grátis? Não, é frete grátis. Sempre é frete grátis? Sempre é frete grátis. Independente da quantidade? Não tem valor mínimo para frete grátis? Eu sempre peguei frete grátis. Não sei se pelo valor que eu compro. Nunca você teve que pagar pelo frete comprando pelo link da revista interativa. E aí, pensando nesses exemplos que você deu de produtos que você conhece pelo site, vai na loja para conhecer, para experimentar, e depois compra pelo site, não, pela revista interativa. E depois você volta. Por que não comprar na loja? Por que comprar com a consultora? Porque eu já sou fiel a ela. Como eu já compro há tantos anos, eu acabo comprando com ela. Tem algum outro ponto que você acha que influenci",compras_digitais,nao_inferido,nao_inferido,nao_inferido
km_013,revista / compra / site / comprar,3,0.6239855289459229,doc_80a271097010f616_pp_ch_0017,doc_80a271097010f616,"Sim, e fora que ele vai aparecer várias marcas, vários produtos, vários tamanhos. Na Natura, não. Já é focado natura. Então, acho mais fácil já procurar direto na revista deles, que aí já tem todas as coisas deles mesmo. E você ficou sabendo dessa revista através da consultora mesmo? Foi ela que te falou e te deu a opção enviando o link? E aí ela só enviou o link uma vez e aí quando você quer comprar você volta sempre nesse link e clica lá? Ela não fica te mandando com frequência? Não, nem precisa. E que na conversa minha eu deixei salvo com favoritos. Então, às vezes, eu vou lá, procuro ela, escrevo a carinha, entro no contato dela, vem favoritos, já clico no link. E se eu tô no computador, já fica salvo também, né, nos meus favoritos. Tá. Aí, mesmo que seja pelo computador, é pelo link da revista também. Sim, sim. É que é a mesma coisa que o site. A diferença é que, como é direcionado para a consultora, então, por isso que eu não preciso ficar digitando... Só eu vendo os favoritos e ",compras_digitais,nao_inferido,nao_inferido,nao_inferido
km_013,revista / compra / site / comprar,4,0.6155344247817993,doc_76c629289d2e414c_pp_ch_0024,doc_76c629289d2e414c,"É parecida, sim, mas é mais... É porque tá a casinha aqui em cima, deixa eu ver. É, assim, tá. E aí, nesse caso? Essa já é a do carrinho, assim, tá certo? Só que aí, claro, aparece tudo, né? Do lado aqui aparece para finalizar, se eu quisesse. Essa aqui, nesse caso, você não finaliza, você envia o pedido por WhatsApp para a consultora. Você põe no carrinho, mas você envia. Para a consultora via WhatsApp. Não, mas assim não aparece para mim. É, não, porque chama outra forma. Essa é uma outra forma mesmo, essa aqui é a Revista Interativa e você recebe o link direto da página, certo? Algum comentário sobre a Revista Interativa? Não sei, é que eu prefiro comprar da forma que eu já compro ali, né? Eu vejo no site mesmo, acho mais tranquilo. Assim, só que eu acho que essa revista interativa tem mais os produtos que tem ali, né? Não sei se consegue ver as outras coisas ou não. Porque aí já aparece exatamente o que tem ali, ó. Assim é como se fosse na revistinha, né? Não me lembra mais o tempo",compras_digitais,nao_inferido,nao_inferido,nao_inferido
km_013,revista / compra / site / comprar,5,0.6104185581207275,doc_96b165a2a6f7a32d_pp_ch_0028,doc_96b165a2a6f7a32d,"Vai faltar coisa, porque uma embalagem de presente, exemplo, na correria do dia a dia ela faz para mim, aí não vai fazer. Ele vai mandar para eu abrir, para eu poder organizar. O que mais? Acho que esse é o principal ponto, sem contar na facilidade também. Aí, eu acho que eu não sei se eu vou poder parcelar. Como eu parcelo com ela? Às vezes dou no final do mês. Te dá essa dúvida de como seria aí a compra, o pagamento. Você mesmo falou que você acaba trocando muito com a consultora, do tipo, ela vai te falando sobre isso, sobre aquilo, te oferece desde o novo. Como ficaria, na tua percepção, essa questão desse à troca da consultora? Por aqui, como você acha que ficaria? Eu acho que ia permanecer. Ia facilitar só porque o pedido ficou digitalizado. Acho que ela até poderia gostar, porque eu acho que ia facilitar para ela enviar para representantes, sei lá, o superior, para poder ela fazer o pedido dela. Acho que ia facilitar. Ela chegou a comentar já com você que existe isso? Não, eu nã",compras_digitais,nao_inferido,nao_inferido,nao_inferido
km_014,boticario / natura / perfume / vende,1,0.6984385251998901,doc_3662c092fa45c669_pp_ch_0024,doc_3662c092fa45c669,"Por quê? Porque Natura me dá uma comissão maior. Entendeu? Não era sobre o produto. Exato, a Natura tem mais treinamento, mas o que é mais forte em perfume é o boticário, ela falou, né? Ela falou que o consumidor pede mais para ela boticário, então por isso que ela vende, mas que a comissão dela é menor no boticário, Então ela vende conforme o consumidor pede. Ela falou que tem consumidor que só usa Malbec, então ela usa a cada dois meses e pede Malbec novo. Então ela fala que ela já compra do boticário porque ela sabe que vai sair. Então é muito... É mais passivo, né? É muito passivo. O consumidor traz o que ele quer e aí ela entende e aí ela direciona para aquilo que ele quer. E oferece quando tem desconto. E ela tem algum caso assim que o consumidor vem mais aberto para alguma recomendação? Ou se ele pede alguma coisa de boticário, se ela tenta converter para a natura, algo assim? Não, ela faz o que ele pede. Faz o que ele pede, exatamente. Foi o que mais nos chamou a atenção. O que",3cs_perfumes,nao_inferido,nao_inferido,entrevista_em_profundidade
km_014,boticario / natura / perfume / vende,2,0.6872214078903198,doc_33640fb8f77ec4a8_pp_ch_0030,doc_33640fb8f77ec4a8,"Isso me preocupa, porque, sim, o boticário acabou de entrar versus a gente, e como assim os clientes já estão indo lá procurando boticário? Ao mesmo tempo, ela disse que a perfumaria Natura, se ela falar isso para os clientes dela, já ajuda, já fica feliz. Bate de 10 a 0 na perfumaria do boticário. Ela falou que dura muito mais tempo, quando o Boticário se passa, daqui a pouco você não sente mais nada e a fragrância da natura é muito melhor. Porém, as pessoas já estão procurando mais Boticário. Isso me deixou bem receoso. E aí ela vende os dois? Ela falou algum ponto sobre direcionar a venda? Então, por exemplo, se o cliente vem procurando alguma fragrância específica de boticário, ela vende ou ela traz algum contraponto de Natura, tenta converter pra Natura, algo assim? Não, porque ela vende dos dois, na verdade, né?—. Aí, para ela... Não. Mas é porque teve casos de entrevistas que eu fiz que, pela comissão, a Natura era mais interessante. Então, a consultora até... Pessoalmente, ela ",3cs_perfumes,nao_inferido,nao_inferido,entrevista_em_profundidade
km_014,boticario / natura / perfume / vende,3,0.6863770484924316,doc_fcc334ae6da3d7f2_pp_ch_0020,doc_fcc334ae6da3d7f2,"Ela só entrou no Boticário quando abriu a loja, porque cliente pedia Então ela falou, eu não faço questão de ser consultora do Boticário, mas o cliente me pede Então eu acabei virando também consultora do Boticário E foi entrando em outras marcas, tudo por pedido de cliente Então a Natura foi a da paixão dela, mas todas as outras foi porque cliente ia pedindo O que ela mais vendia era sabonete, hidratante, perfume. É o forte. Mais mulher. Muito mais mulher que homem. E que ela se comunica hoje com eles por WhatsApp. É muito. Ela faz estoque quando tem promoção. Ama os kits de datas comemorativas da Natura. Por quê? Porque ela pode desmembrar e vender separado cada item e lucrar muito mais. Então, para ela, os presentes da Natura são lucro em potencial para ela. Não é porque é super procurado como presente. Ela compra, lembra e lucra muito com cada item que ela vende. O que mais, Tati? Ela falou mais específico de categoria de perfumaria. Ela vende muito pela solicitação? Então, o clien",3cs_perfumes,nao_inferido,nao_inferido,entrevista_em_profundidade
km_014,boticario / natura / perfume / vende,4,0.6803871393203735,doc_761f127ebf5926ab_pp_ch_0014,doc_761f127ebf5926ab,"Ela era uma boticária lover. Ela amava, assim, ela tinha acho que uns três EGLs. Dois floratas, lili e ela tinha ganhado, ela compra e dá de presente boticário, mas ela tinha ganhado ilia clássico do marido dela, que ela também usava. Ela achou que a gente era do boticário, então ela ficou tempão só falando de boticário. Ela falou assim, mas eu tenho mais dois da concorrência lá dentro. E a gente, que concorrência? Ela, ai, da Natura. A gente, não, agora vamos falar da Natura. Então, a gente precisa saber de tudo, tá? Mas então, ela falava muito, assim, sobre Boticário e ela comprava pra ela e ela dá muito de presente Boticário. Que é uma marca que ela sabe que ela gosta de dar porque ela gostaria de receber. Foi o que ela falou. Então, quando ela quer dar alguma coisa pra alguém especial, ela investe em perfume do Boticário. Então, por exemplo, o último presente que ela deu foi trio de miniaturas de florata pra cunhada dela porque ela sabia que a cunhada dela ia gostar de alguma das f",3cs_perfumes,nao_inferido,nao_inferido,entrevista_em_profundidade
km_014,boticario / natura / perfume / vende,5,0.6781582832336426,doc_9e6379543f294d71_pp_ch_0015,doc_9e6379543f294d71,"Ela fala muito do uso de perfumaria pra ela com essa relação afetiva, assim. Então, ela falou do biografia que ela passa porque lembra o cheiro de uma amiga, falou de alguma fragrância que lembrava a avó dela, até se emocionou nessa hora, falou que gosta muito de perfume X, eu não lembro o que era porque ex-namorado deu, Então ela falou muito sobre essa questão emocional no uso e aí também dá para perceber essa relação emocional nela com a fragrância Luna. É perfume que ela gosta muito e que ela não deixa de ter muito por essa relação afetiva com a marca. Nenhum momento ela fala assim, nossa, eu vou muito para os lançamentos. Ela é bem apegada aos itens que ela usa. Basicamente é o Luna e Florata, mas com destaque pouquinho maior pro Luna, que acho que é a fragrância que ela não deixaria de ter. Mas o que eu senti, Tamari, ela não é aquela consumidora engajada em perfumaria. Ela tem essa relação afetiva, mas eu acho que ela não é aquela pessoa que compra toda hora, faz estoque, repõe, ",3cs_perfumes,nao_inferido,nao_inferido,entrevista_em_profundidade
km_015,idade / nome / trabalho / moro,1,0.7873587012290955,doc_2e794b5b52308c61_pp_ch_0003,doc_2e794b5b52308c61,"Que eu tô só vendo se eu tô anotando direito. E é isso, gente. Pra começar, vou pedir pra vocês se apresentarem. Falar a idade, com quem que mora, o que faz da vida, da onde tá falando, que a gente tem pessoas de várias cidades, só pra gente se conhecer. eu sou [NOME], né? Acho que tem sotaque, né? Eu não sei. Eu não sei se eu tenho sotaque ou não. Então pronto, eu vou chamando e aí vocês vão falando. Quer começar, Gabriel, por favor? Pode ser. Oi, eu sou o [NOME], eu tenho [IDADE] anos, eu sou [NOME]. Também não sei se tenho sotaque. Eu moro com os meus pais e eu sou [NOME] ONG. Legal. Muito bom. Tá ótimo. Obrigada, Gabriel. E você, Alison? Boa noite. Meu nome é Alison. tenho [IDADE] anos. Sou natural de São Paulo. [ENDERECO]. Eu trabalho com manutenção civil. Eu moro com minha esposa e meus dois filhos. Muito bom. Obrigada. E o Emerson? Oi, boa noite. Tudo bem? Boa noite. Meu nome é Emerson, tenho [IDADE] anos, sou eletricista, sou casado, pai de dois filhos e [ENDERECO]. Por enquant",jack_pearson,nao_inferido,nao_inferido,nao_inferido
km_015,idade / nome / trabalho / moro,2,0.7830952405929565,doc_399dacb2736f0f29_pp_ch_0002,doc_399dacb2736f0f29,"Se eu cair, também espera pouquinho que a gente logo soluciona e eu entro novamente, tá bom? Então, vamos lá. O que eu quero de vocês? Antes de mais nada, eu não conheço vocês ainda. Então, retratinho básico, tá? A idade, de onde vocês estão falando, com quem vocês moram, se vocês trabalham, se ensinam o quê. Quem quer começar? A Júlia, espera aí, acho que a Júlia está entrando. É isso, Júlia? Quem quer começar? Bom dia. Bom dia. Quer falar, Natália? Você apresenta, então. Porque sempre sobra. Vamos lá, bom dia, meu nome é Natália, tenho [IDADE] anos. Casada, tenho filho de 11. Minha mãe mora com a gente também. eu sou [NOME]. Gosto muito, adoro fazer aqueles bolos maravilhosos. E acho que é isso. Você é de São Paulo? Sou de São Paulo. Me diz uma coisa, qual a idade dos seus filhos? Do filho? 11. Onze, filho. Tá ótimo, obrigada Natália. Quem vai? Fala Maria Eduarda. Oi, meu nome é Maria Eduarda, eu tenho vinte e cinco anos, eu sou [NOME], eu moro na Tijuca, eu tenho filhinho de dois an",bem_maes,nao_inferido,nao_inferido,nao_inferido
km_015,idade / nome / trabalho / moro,3,0.7801275849342346,doc_f32e185da3913dd6_pp_ch_0001,doc_f32e185da3913dd6,"Bem, posso começar. Vou me apresentar, tá, Magno, pra você. Meu nome é Helen, então, trabalho aí na Quira, a gente tá nesse projeto. Putz, eu adoro conversar com o consumidor. tenho [IDADE] anos, sou mãe de três filhos. E sou uma pessoa que, quando eu me apresento assim, se alguém precisa de ajuda para dar presente, eu sou a [NOME] a me oferecer, porque eu adoro presentear as pessoas. E moro aqui em São Paulo, enfim, e trabalho aqui na Kira, mas é isso, me apresentando. Oi, Magno, meu nome é Juliana, também estou aí junto com as meninas, trabalhando na Kira, tenho [IDADE] anos e [ENDERECO]. Oi, Magno. Eu não sou a [NOME], sou a [NOME]. Tá, tá. Também tô na Kira, tenho [IDADE] anos, tenho dois filhos e eu [ENDERECO], então tô pouco mais distante das meninas aí de vocês. Certo. Eu sou o [NOME]. Você mora aqui em São Paulo? eu sou [NOME]. Eu tenho [IDADE] anos. Estou solteiro e moro com a minha mãe. Legal, Magno. A gente está aqui, então, para te ouvir, para te conhecer. Então, não tem ce",natura_3cs,consumidoras,natura,nao_inferido
km_015,idade / nome / trabalho / moro,4,0.7763694524765015,doc_c3440e03873d8788_pp_ch_0002,doc_c3440e03873d8788,"E de onde você está falando, Bruna? eu sou [NOME]. Do Rio, beleza. Obrigada. De nada. Posso? Então, meu nome é Ilana, tenho [IDADE] anos, sou mãe gemelar, são dois meninos de [IDADE] anos, sou casada [IDADE] anos, sou formada em secretarado executivo, tenho uma pós-graduação em andamento de psicopedagogia, falo do Rio Grande do Sul, Porto Alegre. Tá ótimo, Ilana, muito obrigada. Quem vai ser a próxima? Eu, Alexandra? Bom dia, tudo bem? Eu tenho [IDADE] anos, tenho dois filhos, rapaz com [IDADE] anos e uma filha de [IDADE] anos, sou formada em pedagogia, só que eu trabalho também com vendas de roupas e também estou fazendo bico numa empresa que é para shoppings e atualmente eu estou morando na São Miguel Paulista, Zona Leste, mas eu sou do Espírito Santo, Vitória. Tá ótimo, Alexandra. Muito obrigada. Pode falar, Eliana. Depois fala Elisabeth, tá bom? Olá, gente. Bom dia, prazer estar aqui com vocês. Meu nome é Eliana Miranda, eu falo daqui de Salvador, Bahia. Eu tenho dois filhos, Anaís",radiosa,nao_inferido,nao_inferido,nao_inferido
km_015,idade / nome / trabalho / moro,5,0.770296037197113,doc_7125fa2ef3d8b81c_pp_ch_0003,doc_7125fa2ef3d8b81c,"Oi, gente. Boa tarde aí também. Eu sou o [NOME], tenho [IDADE] anos. Ultimamente eu moro com os meus pais. eu sou [NOME] de TI e [ENDERECO]. Perfeito, obrigada. E você, Giovani? Bom, gente, boa tarde. Meu nome é Giovani, eu tenho [IDADE] anos. Sou analista de treinamento de uma empresa de telecomunicações. Eu sou do Rio de Janeiro. Tenho hobby, geralmente, de praticar esporte. Eu gosto muito de crossfit. Bem carioca, né? Não, porque nessa cidade tem mais é que praticar muito esporte pra ficar na beleza, né? É, tem que aproveitar as coisas boas. Exatamente. Obrigada, Giovani. E você, Tiago? Bom, meu nome é Tiago, tenho [IDADE] anos, sou de Recife, casado, tenho três filhos, trabalho como consultor jurídico e o meu hobby é ciclismo. Também é outra cidade que é gostoso de andar de bicicleta, né? Sim, sim, bastante. Muito bom. Obrigada, viu, Tiago? E você, Lucas? Tem dois Lucas agora. Deixa eu pegar o Lucas Siqueira e depois o Lucas Duarte. Vamos lá, Lucas Siqueira. Me apresentar? Oi? Isso",jack_pearson,nao_inferido,nao_inferido,nao_inferido
km_016,pele negra / negra / pele / linha,1,0.7539881467819214,doc_bc29e08f3450ea98_pp_ch_0062,doc_bc29e08f3450ea98,"E se todo dia, só perguntando para a Diana também, se todo dia lançasse uma linha de cuidados para pele negra, o que você acharia? Ia ter uma para cada tipo de pele negra? Essa é a pergunta. Pele seca, pele mista, pele retinta, entendeu? Teria que ter uma linha então. Mais abrangente para despertar a curiosidade, como eu comentei com a Sheila, eu usaria para saber qual que é o... Como que eles chegaram nesse quê aí de falar que minha pele negra é igual a todas as outras peles negras, né? Eu já vi que não é legal falar que a pele negra não é uma só, tem várias diferenças e tal, e o que você acharia da marca Todo Dia, da linha, se ela tivesse a proposta de lançamento de produtos? Assim, essa iniciativa, você acha o quê, pensando em Todo Dia? Eu... É o que eu tô falando. Eu acho que vai separar a gente do todo. Porque a pele... Você não acha legal no trono? Não. A não ser que tenha algo assim, né? Vai ter negócio de clareamento muito específico. Não sei. Mas, do contrário, eu vejo... É qu",radiosa,nao_inferido,nao_inferido,nao_inferido
km_016,pele negra / negra / pele / linha,2,0.7469102740287781,doc_b71f944ee9bec4b0_pp_ch_0026,doc_b71f944ee9bec4b0,"Mas você acha que seria melhor lançar produto, uma linha para pele mais ressecada ou para pele negra, exclusivamente também falar para pele negra? Eu acho que papele negra ia deixar a gente mais assim, sabe? Mas sentindo pouquinho mais na visão de todo mundo. Todo mundo tem, né? É pra todo tipo de pele, mas a pessoa fala, ó, essa aqui é pra pele morena, essa aqui é pra pele... Ninguém fala assim, essa aqui é pra pele negra, essa aqui é pra pele morena. Então, assim, quando colocar assim, pra pele negra, eu acho que vai fazer bem pra gente, pra nossas crianças que estão vendo aí as conquistas. Legal. Melissa, o que você acha disso? A gente está falando o seguinte, se a pele negra tem necessidades específicas e seria bom ter produtos específicos para o cuidado da pele negra, se já tem alguma marca que faz isso, o que você acha de tudo isso? Eu acho que é importante, sim, ter produtos exclusivos pra pele negra, porque eu acho que passa mais uma representatividade, porque a gente... O que ",radiosa,nao_inferido,nao_inferido,nao_inferido
km_016,pele negra / negra / pele / linha,3,0.7361051440238953,doc_3d71a73387cbd4a7_pp_ch_0034,doc_3d71a73387cbd4a7,"Eu acho que a base deles, até para divulgação, para a pele negra, seria da nutrição. Eles iriam pegar e fazer algo que fosse... Porque a diferença da pele negra para a pele clara é por conta da melanina. Então, a gente precisa intensificar isso para a gente se manter protegida durante o sol. Então se eu não quiser usar hidratante porque eu não gosto da textura do hidratante e eu puder usar o óleo e ele tiver também esse tipo de ação, pra mim também vai ser muito bom. A gente vai acabar atingindo todo mundo, né? A gente não vai ficar só atendendo quem usa o hidratante. E esse fator não tem nem na linha Ecos e nem na linha Todo Dia. Você vê que na linha Todo Dia não tem óleo. É só da linha Ecos mesmo. Linha Todo Dia não tem óleo. Miriane, vamos lá agora. Miriane, o que começou? Deu essa ideia, já quero saber. O que você acha que seria legal ter na linha de cuidados para pele negra? Eu acho, concordo com o Cris, também óleo para ajudar ainda mais na hidratação, para diminuir o ressecament",radiosa,nao_inferido,nao_inferido,nao_inferido
km_016,pele negra / negra / pele / linha,4,0.7302152514457703,doc_3d71a73387cbd4a7_pp_ch_0045,doc_3d71a73387cbd4a7,"A qualidade, né? Porque surgiu a nova fragrância para pele negra, hidratante, dentro da alergologia. Isso, as clínicas de pele negra vão ter acesso ao produto de qualidade, porque se o hidratante da linha todo dia pra todos os tipos de pele já hidratam, então pra pele negra tem uma hidratação melhor. O custo também, que o hidratante da linha todo dia é mais excessivo do que a Ecos, também vê esse lado. E eu acho que o que interessa muito é a questão de aceitar, com certeza, a gente de pele negra tem essa necessidade de hidratação. Então, pra chegar produto mais rápido até os clientes, eu acho que colocando na linha todo, a gente teria sucesso mais rápido, até criar uma linha pra gente. Entendi, quer dizer, fica como entrada em todo dia, mas o desejo mesmo é uma linha, é uma marca própria. Então, tratamento específico, como as meninas falaram, não importa que seja custo maior, sabe? Porque se vai hidratar mais, vai ter custo maior na venda. Então, eu acho que isso deveria também ser lev",radiosa,nao_inferido,nao_inferido,nao_inferido
