cluster_label,auto_label,rank,similarity_to_cluster_centroid,chunk_id,doc_id,excerpt,projeto,publico,marca_foco,tipo_sessao
km_008,fusao / pedido / natura / avon,3,0.6366381049156189,doc_9da29b5ddacac7d2_pp_ch_0025,doc_9da29b5ddacac7d2,"É porque o livro só tem intimidade aí, tá? Mas nem se tinha falado, né? A gente perdeu a intimidade toda a gente. Né? Não era amiga, né, Gina? Ela era minha amiga. Era uma coisa assim, né? Ela interpretava o pedido. Sim, ela era minha amiga. Eu tinha ajudado ela, né? Quebrava os dados. Quebrava os dados, ajudava. Que facilitava essa coisa do... Bom, pedi esse mês, vamos ajudar com esse ciclo. Então, eu tô em fase da adaptação ainda. Quando ela aparece ser bem visão. Então, eu cheguei a entender esse ponto. Mas você usava a sua líder assim, né? Eu acho que dá isso. Ela estudava, ela superesse a líder. A minha não mudou. Eu tive essa sorte. Que sorte! Levanta a mão, quem mudou? Quem teve a líder mudada, sei lá. Todo mundo menos... Você também, né? A minha mudou. Então, nesse sentido, a minha... Isso aí eu tô tranquila. Porque antes dela ser minha... Ela era revendedora junto com o Kiko. Ela virou líder, virou líder de Amigas. A gente tinha esse esquema mesmo. Eu já completei meu pedido. ",mercato_brasil,nao_inferido,nao_inferido,nao_inferido
km_008,fusao / pedido / natura / avon,4,0.6215587854385376,doc_4b466654cd374bdf_pp_ch_0028,doc_4b466654cd374bdf,"Saco, você foi mesmo, não teve negócio... Não teve negócio assim, tipo... Veio a público, por exemplo? Não, não teve. Então isso gera muita dúvida... Além disso, chegou, conversou comigo, olha, vai entrar no jogo, tudo... Mas também foi isso. Mas a sua líder, Natura, que falou pra você. A minha líder, Natura, só disse que ela não ia ser mais líder devido a fusão que a gente já sabia. Pelos crew que a gente já tava. Mas que ela ia pra outro patamar dentro da empresa, mas se eu precisasse dela, tinha o contato dela pessoal e fulano de tal. A minha líder era a partir de agora. E aí, eu conheci a líder na festa de [IDADE] anos. De consultora de [IDADE] anos. Então, pera lá. A gente soube meio de lá. É, da Rádio Peão. Português, claro, foi da Cádipiano. É, e você falou, né, que tava vendo aqui na rotina... Não, mas era, tipo, cara, foi assim, do nada, eu fui passar pedido da Natura, tinha mapa da Avon lá. E aí, o que você fez? Cara, o que é isso, né? Tipo, beleza, não vou pedir Avon agora, ",mercato_brasil,nao_inferido,nao_inferido,nao_inferido
km_008,fusao / pedido / natura / avon,5,0.6196228265762329,doc_0dc2e6ecde931dc0_pp_ch_0023,doc_0dc2e6ecde931dc0,"Tem uma coisa, só que eu posso falar uma coisa, deixa eu voltar. Eu tomei diamante que veio pra mim. Ele já se assinou no meu grupo há uns [IDADE] anos. Só que ele era de indígena e ele veio bloqueado. O que falou? Ele não consegue passar por aqui? A mão, só que a mão mesmo você aceitou ele, e esse é aquele lojinha, e quem vai pagar essa conta? Eu sei, pela segunda vez. Porque é diamante, o senhor que. Não vai fazer pedido. Porque a Natura deveria ter visto, a Natura deveria ter verificado isso já, porque. Agora vocês sabem, nem colocaram. Não tinha colocado ninguém. E a invasão tem o cadastro dele e da irmã, então não vai fechar. Então, a nossa preocupação hoje também tem que ver. Nós vamos perder muita gente. Muita gente. E aí? E aí, quem é culpado? A gente vai... É, vai para o espaço. E a gente vai refletir depois? Não, eu estou falando de morte. Em todos os aspectos, já está refletindo a gente, vai continuar refletindo até que essa relação no meu ponto de vista seja restabelecida. ",mercato_brasil,nao_inferido,nao_inferido,nao_inferido
km_009,produto / marca / produtos / questao,1,0.6114009618759155,doc_a11e5233b2bda4e2_pp_ch_0046,doc_a11e5233b2bda4e2,"Bem legal, eles estão usando muito menos, como que é, coisas artificiais, química, dentro do produto, que para o nosso cabelo é maravilhoso, para nossa saúde é maravilhoso, e para o ambiente não tem nem o que falar, né? Eu acho que é bem legal. Eu acho que é uma coisa que eu já esperava da Natura. Isso aqui já esperava, ou seja, tá dentro. É, pra mim tá dentro, porque a Natura, ela sempre teve a pegada natural, né? E a cada produto que ela lança, ela usa mais porcentagem de produtos naturais. Então, pra mim tá dentro, pra mim tá ok. O próximo vai ser 100%. É muito bom, mas não é diferencial, sabe? Pensou 100%? O próximo que eles lançarem vai ser 100% porque cada vez está melhorando. E aqui 100% clássico da Natura, primeira marca 100% velho clássico da Natura. Acho bacana. E aqui, vamos ver essa parte aqui. O que vocês acharam? Porque estamos terminando, tá? O que vocês acharam desses elementos? A única coisa foi o sabonete condicionador, né? Que você falou que tá errado, que é condicio",biome,nao_inferido,nao_inferido,nao_inferido
km_009,produto / marca / produtos / questao,2,0.603203296661377,doc_813751e4679e395b_pp_ch_0028,doc_813751e4679e395b,"Aí vou colocar o famoso Defende, porque a gente sabe que existem até produtores pequenos que fabricam sabonetes em barra e que tem todo esse cuidado que a natura tem também na produção. Eu acho que Quando a gente está falando de uma pessoa pequena e que tem uma filosofia específica, até se foi enveredar por esse caminho de cosméticos orgânicos e outras coisas, também tem uma ligação muito grande. A diferença, às vezes, quando a gente olha, qual é a consequência de a gente... A cadeia positiva, também, que uma empresa maior consegue oferecer. Então, se a gente está falando de usar uma pequena ou usar uma grande, vai, às vezes, pouquinho do que você melhor se adapta, o que você tem acesso. Como o Rodrigo falou, se ainda não teve acesso, a gente tem que levar ele para conhecer outros. Tem os outros acessos, né? Mas eu acho que também uma empresa grande, ela consegue gerar uma cadeia pouco maior, uma cadeia positiva pouco maior pelo tamanho, né? É, Ana, eu já usei shampoo Ibarra, Cadivel, ",biome,nao_inferido,nao_inferido,nao_inferido
km_009,produto / marca / produtos / questao,3,0.595152735710144,doc_813751e4679e395b_pp_ch_0046,doc_813751e4679e395b,"E como soa essa olhenda dendê? Como soa o que eles falaram? Eu vou falar assim, ele é óleo natural, a gente fala assim, tem que ter, não é originário do Brasil, mas ele faz muito parte da nossa cultura, então eu acho que é utilizar coisas que a gente tem aí em abundância de uma forma eficiente, a gente não precisa usar produto químico como uma base para rinçar, eu acho que é termo que talvez exista, rinçar o cabelo, que é trazer, conectar o cabelo. Marina, você já tinha ouvido falar nesse oleína dendê, alguma coisa semelhante nesse produto? Opa, desculpa, estava fechado. Especificamente oleína dendê, não. O que você tinha em mente de ingrediente? Não, eu tenho ingrediente, por exemplo, castanha, essas coisas que já são dos produtos da Natura, né? Na loja até a moça explica, uma outra coisa pouco ali sobre a matéria-prima, mas não... Esse nome, Oleína dendê, não me recordo dela ter me explicado, não. Mais alguma questão dessa parte aqui, que chamou a atenção, que foi interessante, ou qu",biome,nao_inferido,nao_inferido,nao_inferido
km_009,produto / marca / produtos / questao,4,0.5882077813148499,doc_c81de68b7ac9189d_pp_ch_0049,doc_c81de68b7ac9189d,"Tudo o que a Zminia falou é mais pouco aqui, porque a Natura, além de ter hidratante, ela tem sabonete, tem shampoo e base, ou seja, há uma grande inovação de produto que ainda pensa natureza e está sendo vegano, coisas que a gente não vê muito. Então, eu gostei bem disso. Gostei também das pessoas, da diversidade, eu mostrando o corpo real, mostrando a realidade. Gostei também da junção de sérum com base. Isso, todos os momentos da vida também que ele dá. E também, tipo, todos... Vamos dizer que traz uma sensação de alegria, outro de paz, calmaria. Essas sensações, assim, que traz os produtos. Olhar essas propagandas aqui hoje, essa proposta de propaganda de Natura, Muda a impressão que vocês têm dessa marca? Agrega alguma coisa para essa marca? A marca perde alguma coisa fazendo uma propaganda assim? Como que fica agora que vocês já viram tudo? Gabi, me conta. Eu sempre tive uma imagem bem boa da Natura, sempre usei os produtos, então acho que só agregou mais com tudo que eu vi. Tant",rosacea,nao_inferido,natura,nao_inferido
km_009,produto / marca / produtos / questao,5,0.5833705067634583,doc_b53730e47cc798ef_pp_ch_0067,doc_b53730e47cc798ef,"Sim, acho que devia ser redondinho também, esse formato, é oval na verdade, meio triangular. É bem a ideia da palma da mão, formato bem definido. Eu achei interessante essa tua colocação. Eu até por momento pensei, como você falou, do formato da embalagem, Prefiro não comentar, não achei que tivesse relevância, mas que bom ouvir o que você falou, Isabel. Eu acho que ela em forma circular não vai ficar tão interessante, até mais uma questão de logística mesmo, acho que dificulta pouco, mas... Eu sei, eu tô incomodada com a embalagem mesmo, mas eu não sei se necessariamente é o formato dela. Eu acho que... Não sei, pode até ser quadradinho, uma coisa mais... Altinha, sei que me desce a impressão que tem algo ali dentro, que pra mim tá parecendo que tem sabonete de hotel aí dentro, tem uma coisinha assim. Pois é, assim, eu sei de outros produtos, acho que da Natura também, que já tem esse formato mais anatômico, não tão, sabe, ângulos retos e tal, e eu acho que Esse produto, tipo, ele tin",biome,nao_inferido,nao_inferido,nao_inferido
km_010,transmite / tecnologia / embalagem / parece,1,0.7104099988937378,doc_40a5bd913d6434d3_pp_ch_0024,doc_40a5bd913d6434d3,"Não dá para pegar só a imagem... Mas a cor, a embalagem me atrai. Transmite o quê para você? O que mais? Certamente, eu pegaria para olhar, para ler, para ver do que se trata. Essa imagem de fundo te transmite alguma mensagem, Suzana? Eu gosto, eu gosto dessa imagem de fundo também. Parece moléculas, parece água, sabe? Uma coisa assim de profundidade, sabe? Do mais superficial ao mais profundo. Qual deles, gente, transmite mais a mensagem de inovação? É o S5. S5. Eda, qual transmite para você a mensagem de inovação? Eu também vou concordar com as meninas, esses cinco. Onde que tá a inovação aqui dessa imagem? Onde que vocês viram inovação aí? O design da embalagem. Mas é a cor mesmo que me chamou a atenção. Mara, onde você viu inovação aí? Eu achei a embalagem sofisticada, a cor dela assim se enquadra, parece ser dourado meio rosê. Ela ficou chamativa, ela chama a atenção. Quando a gente bate o olho assim, quer pegar o pote para ver o conteúdo. Susana, onde tem inovação aí? Sabe que a ",gaia_ii,nao_inferido,nao_inferido,nao_inferido
km_010,transmite / tecnologia / embalagem / parece,2,0.7037023305892944,doc_40a5bd913d6434d3_pp_ch_0029,doc_40a5bd913d6434d3,"Qual delas, gente, transmite mais a ideia de sofisticação? Além da S14, mais alguma transmite sofisticação? Essa que tá aqui no cantinho, do lado da A, é que não tá mostrando o número dela. Está do lado de qual? Do S5? É, esse daí. Transmite sofisticação? Por que, Omar? Ela transmite sofisticação? A embalagem dela. Tem o que essa embalagem? Ela tem algo que chama a atenção, é uma coisa que parece ser positiva. A cor dela, o brilho, chama... Você olha assim, você se interessa. Mais alguma? Suzana, mais alguma? Colocaria também a S16, né? Também. Talvez pela forma como elas estejam apresentadas, né? Forma de apresentação, né? Qual delas, gente, mais transmite a ideia de inovação? Eu acho que eu ficaria com a S6. S6. O que ela tem que transmitir inovação? Porque parece ser óleo, parece ser sérum, parece sair daquela coisa tradicional do creme, né? Uma linha mais moderna, de mais pesquisa. Eu também... A inovação é o S6. Por quê? Porque ele está mostrando que é algo que está... Inovando, n",gaia_ii,nao_inferido,nao_inferido,nao_inferido
km_010,transmite / tecnologia / embalagem / parece,3,0.6666635274887085,doc_d26ac17df9e509e7_pp_ch_0046,doc_d26ac17df9e509e7,"Qual deles, gente, parece contar com uma tecnologia avançada? Eu vou continuar com S12. S12. Lidiane? Eu acho que eu vou agora pegar o nosso Cronos ali, a nossa marca brasileira. O S6. Desculpa, Ná. Eu já estou falando. Vamos lá. S1. Onde está a tecnologia avançada do S1? Parece que ele tem uma tecnologia avançada, porque parece que ele tá flutuando na imagem. Então, é da impressão. Ele tem as cores, a embalagem, a forma que a embalagem do produto tá, parece que ela realmente tá envolta nessa água aí. Então, dá uma sensação meio futurista. É a pergunta, a tecnologia avançada, tu diz as embalagens ou a relação ao produto? Tecnologia avançada, o que... A imagem, tanto faz, se é produto, Se é embalagem, se é outra imagem... Tá, tá. Eu peguei o gancho, assim, mais produto, tá? Eu, assim, que eles estão investindo muito, assim, em componentes pra melhorar bastante, né, a linha. E eu acho isso. Mas o que essa imagem aí traz de tecnologia? Onde você vê tecnologia aí? Pois é, agora pensando de",gaia_ii,nao_inferido,nao_inferido,nao_inferido
km_010,transmite / tecnologia / embalagem / parece,4,0.6648085713386536,doc_c1b714ce1513e838_pp_ch_0039,doc_c1b714ce1513e838,"E o tamanho também, como ela falou, é bom, né? Qual dessas imagens, gente, passa mais a ideia de uma marca que tem uma solução completa, tratamento completo para os cuidados do rosto. Deu. É, deu. Pra você também? Sim, deu. E como a gente percebe isso, que ela tem essa solução completa? Olha, ela tem esse azul, dá tanto azul aí, eu acho que deve ser o artesinais. Aí tem o cérebro, aí tem o olhozinho, né? De antes, deve ser da área dos olhos. Tem que parece esfoliante, não é? Esse beijinho que tá do lado desse azul. É isso? É. Tá. Qual deles, gente, transmite melhor a ideia de tecnologia avançada? Aí eu já vou ficar com o D11. Isso, eu também. Tá mais sofisticado, tá mais bonito, tá mais elegante. Mas ele transmite mais tecnologia, Valéria? Ou ele transmite mais sofisticação? Mais tecnologia. Tá, então vamos lá. Então me fala, onde que a gente vê tecnologia aí nessa imagem? Esse produto aí, comprido, o da Lancome, tá vendo? Esse comprido e o deitado. E eu acredito que os dois potinhos d",gaia_ii,nao_inferido,nao_inferido,nao_inferido
km_010,transmite / tecnologia / embalagem / parece,5,0.6573472619056702,doc_6446f54127e74c2d_pp_ch_0034,doc_6446f54127e74c2d,"Uma embalagem diferente. O S6. Anne, onde a gente vê inovação aí no S6? Onde vê inovação? Também. É uma embalagem simples. Você consegue observar o nome do produto de uma forma... É uma embalagem simples, é uma embalagem bonita, Ela dá a sensação de que você está usando produto extremamente bom. De onde vem essa sensação de produto bom? De onde vem essa sensação de produto bom? Eu gostei da cor da embalagem também. De onde vem essa sensação de produto bom? Talvez eu conhecer a marca. Marca conhecida. S16. Por que está transmitindo inovação, Márcia? Assim, pela embalagem, por essa cor azul, sabe? Que fizeram essa cor azul, é diferente. Ele passa uma impressão de refrescância, de leveza, né? A forma assim como apresentaram ele, a propaganda assim, chamou a atenção. Tecnologia avançada. Quem aqui transmite tecnologia avançada? Tecnologia avançada? Jociara, algum transmitir? O S1. O S1 também. S1, Carla. Não consigo entender o que é o S15 ali. Tá ruim a imagem. É, não entendo, mas ele me p",gaia_ii,nao_inferido,nao_inferido,nao_inferido
km_011,energia / energizante / usaria / banho,1,0.720795214176178,doc_7244ee28c4ae4fdf_pp_ch_0042,doc_7244ee28c4ae4fdf,"Eu usaria ele com a bucha do corpo. Eu acho que eu casaria os dois e usaria também com a esponja, com a escova. Pensa só nesse por enquanto, finge que não tem escova, se não tem mais escova. Dá pra usar ou não? Não sei se usaria. Usaria sim. Por que todo mundo tá empolgada com isso, gente? O que empolgou tanto aí? O que você está imaginando deles? Eu acredito que é uma mistura de todas as composições, tanto do creme, quanto do líquido, quanto do gel, que vai estar tudo num produto só, na hora do banho também, que é muito gostoso, além de dar toda a limpeza necessária, vai te dar a energia e a composição que os outros também ofereceram. Que mais, hein? Limpeza, energia, que mais que ele vai entregar? A pele macia, né? A hidratação natural. O banho desigurante. A energia que ele deve dar pra gente, né? Então, vamos lá. Eu queria pegar essa coisa, porque muita gente falou energia, pele revigorada, etc. O outro lá que passava no bus, ninguém falou lá, isso aí não vai dar energia a nada. Po",havana_iii,nao_inferido,nao_inferido,nao_inferido
km_011,energia / energizante / usaria / banho,2,0.7153104543685913,doc_7244ee28c4ae4fdf_pp_ch_0023,doc_7244ee28c4ae4fdf,"Quem é que... Vocês já tinham visto alguma coisa assim ou parecida com isso? Não, eu nunca vi assim de outras marcas. Hidratante que dá pra gente usar fora do banho, né? E dentro do banho, e que promete essa hidratação, a facilidade de espalhar. Tá, eu ia perguntar o que ele tem de diferente, sei lá, nunca vi. O que ele tem de diferente dos outros cremes nutritivos? Eu acredito que seja essa energia que ele vai dar para o nosso corpo. Porque o creme que eu uso, eu não acho que seja creme que não seja parecido com ele. Pelo menos o creme que eu uso atualmente, eles me dão uma nutrição muito boa para a minha pele. Eu gosto tanto do cheiro quanto da hidratação que eu tenho durante o dia. Inteiro que eu uso. Porém, essa fala da energia que ele vai nos dar, eu acho que é uma coisa que foca, que muda o produto. E o que ele tem que dar energia? Por que a gente... Tudo bem, ele chama creme nutritivo energizante, beleza. Mas o que tem nele que linka com esse benefício de energia? Vocês que me f",havana_iii,nao_inferido,nao_inferido,nao_inferido
km_011,energia / energizante / usaria / banho,3,0.7092283368110657,doc_4fb6c79b4c64bba8_pp_ch_0020,doc_4fb6c79b4c64bba8,"Isabela, Thaís, Jádila. Jádila, tira do mudo, porque senão toda vez que for tentar falar demora pra você falar, então pode deixar fora do mundo. Vai lá, Jádila, o que você achou? Eu achei, pra mim, inovador, porque eu nunca vi esse tipo de produto que dá essas informações, ou que vai promover no banho, informando que dá pra dança, eu achei bem legal. Que mais? E bem diferente. Thaís, Isabela, alguma coisa a dizer? Eu gostei muito porque é o bom momento pra gente relaxar, né? Pra cuidar da gente, do nosso corpo. E aí, é esse momento de relaxar. E é perfume, não adianta. Eu acho que é muito ótimo. Quem usa esse produto, consegue o quê? Qual que é o benefício que ele traz pra quem usa? Relaxar durante o banho. Relaxar durante o banho? Por que vocês tão falando muito de relaxamento? Por que relaxamento veio tão forte? Porque vai... Acredito que liberando já o cheiro, a fragrância da... O produto já vai dar uma relaxada, vai proporcionar banho bem mais leve, com maior cheiro. Então, mas ó..",havana_iii,nao_inferido,nao_inferido,nao_inferido
km_011,energia / energizante / usaria / banho,4,0.6846821904182434,doc_4fb6c79b4c64bba8_pp_ch_0024,doc_4fb6c79b4c64bba8,"Eu usaria junto com o vapor no banho. Vou pedir só uma, eu sei que vocês agora vão começar a fazer links, vamos só ver esse por esse, aí depois a gente vê com o que combina, o que é outro, mas vamos pensar no creme nutritivo. O que vocês acharam desta ideia? Ele é muito bom, porque ele não. Precisa usar aquele óleo, porque eu particularmente não sou muito fã de óleo, não gosto de óleo, porque me dá a sensação de uma pele grudenta. Então, ele substituiria o óleo dentro do banheiro e dá para usar como o creme hidratante mesmo, nutritivo fora. Então, eu não precisaria comprar ele e mais óleo. Os dois já valeriam por e dois em no caso, na verdade. O que mais, gente? O que vocês acharam? Também, eu acho que ele me lembra muito o texto do primeiro, como se fosse para ele o texto, e eu acho que ele tem esse de energia, as coisas que vai me deixar energizada para o dia ou para a noite também para descansar e estar tranquila. Passou energia aqui, Fernanda, para você? O que te remeteu energia aq",havana_iii,nao_inferido,nao_inferido,nao_inferido
km_011,energia / energizante / usaria / banho,5,0.684276819229126,doc_4fb6c79b4c64bba8_pp_ch_0031,doc_4fb6c79b4c64bba8,"Eu também gostei. E eu acho que esfoliante, não sei porque, me passa uma imagem de energizante, não sei. O esfoliante linkou com o energizante já a facinho assim, Fernanda? Sim, pra mim sim. Foi, me pareceu que tipo o esfoliante... O que vocês mais gostaram dessa ideia aqui? O que tem? Alguém falou maravilhoso, alguém falou surpresa? Porque esfoliante... E energizante, eu acho que esfoliante para deixar mais refrescante é bom assim às vezes, mas eu não usaria todo dia. Tá, quem mais? Giovana, fala alguma coisa sobre esse produto. Eu acho que agora sim me remeteu ao que talvez teria que me remeter lá no primeiro produto da esponja. Agora sim, eu faria a esfoliação, Para mim, na minha cabeça, essa é a esfoliação certa. E esfoliação é que nem eu já falei, é automático. Vai no seu relaxar deixar a sua pele limpa, refrescante e energizada. Automaticamente quando as coisas se linkam. Tá. Thaís, Isabela, Jágui... Assim, eu usaria todos os dias. Embora que aqui está falando assim, utiliza até ",havana_iii,nao_inferido,nao_inferido,nao_inferido
km_012,tecnologia / bio / bioeficiente / produto,1,0.7205336689949036,doc_3a9c3f93806290fb_pp_ch_0053,doc_3a9c3f93806290fb,"E daí o bio tá ali o que aqui pra esse jogo assim? Porque se é eficiente, beleza, mas e o bioeficiente, como é que fica? Eu acho que seria... Parando assim pra pensar igual você falou, tipo, o bio, acho que ele entraria muito bem ali na E, né? Proteção natural, seria algo que não seria algo prejudicativo, não seria algo fora do... Esqueci a palavra que fala, mas seria algo mais natural, tipo, bem algo natural, só que não muito fora do comum esse bio eficiente. Tá bom? Nada exagerado. Nada exagerado. E os outros, o que pensam do bioeficiente para esse contexto de benefícios? Para mim, o bioeficiente não soa muito como nome de tecnologia. Por quê? Ele soa mais como o contexto do produto. O produto é bioeficiente porque ele vem da natureza, ele utiliza da natureza, ele volta para a natureza sem agredir a natureza. Mas nome de uma tecnologia... Tipo assim, de todos os nomes que a gente tem aqui, os que a gente não gostou mais são os que estão todos em português, ou que não são nomes meio q",jack_pearson,nao_inferido,nao_inferido,nao_inferido
km_012,tecnologia / bio / bioeficiente / produto,2,0.6901861429214478,doc_7125fa2ef3d8b81c_pp_ch_0024,doc_7125fa2ef3d8b81c,"Perfeito. E Getúlio? Então, na minha opinião, tem uma palavra que não foi falada, mas foi dado voltas nisso, tá? Que é o quê? Pele. Ele falou pH, né? Pra mim, esse nome Dermotech, me vem uma palavra na cabeça, antialérgico. Como se fosse uma tecnologia, porque aqui não tem nada de bio, tá? Mas como se fosse alguma tecnologia nova, para uma linha de alguém que talvez tenha alguma certa alergia ou uma sensibilidade para produtos convencionais. E levando em consideração, então, o dermo, né, que seria para cuidado, uma tecnologia de cuidado com a pele. E eu acho que também não casa esse nome por causa do próprio dermo, né, tendo em vista que vai ter produto para barba, para cabelo. Perfeito. Muito bom. Ou seja, a comida. Aqui a gente restringiu, ficou restrito ou a pele, ou a alergia, quer dizer, não ficou uma... Não necessariamente vai falar com o que eles estão planejando lá, de ter uma linha grande, que vai ter shampoo, que vai ter perfume, é isso? Posso falar isso para eles? Muito bom.",jack_pearson,nao_inferido,nao_inferido,nao_inferido
km_012,tecnologia / bio / bioeficiente / produto,3,0.6859139204025269,doc_66b40b2eb6436092_pp_ch_0015,doc_66b40b2eb6436092,"Isso é uma coisa que tudo bem para você? Você gostaria de produto natural muito eficiente? Você é magno para esse aí, bioeficiente? Então, na verdade, eu mantenho, como eu já tinha dito anteriormente, a questão do bio. E o eficiente não temos muito o que fugir, né? A palavra só tá escrito, pronto, de uma forma direta, mas é algo que seria eficiente. Porém, não é o nome que me agradaria, não. Bioeficiente, tá. Eficiente em quê? Em quê? Fica uma dúvida aí. Ficou certa a dúvida, então não é algo que chamaria a minha atenção, não. Não é isso não. Isso. Novamente, a palavra bio me remeteu a algo mais de vida, natureza, enfim. Já o eficiente, justamente levei para o sentido literal da palavra, de que é uma tecnologia eficiente naquilo que ela se propõe. Por exemplo, shampoo para cabelos secos. Então, ela é eficiente em tratar os cabelos secos, deixando eles mais sedosos. Enfim, justamente por esse sentido de capacidade, levei realmente pelo sentido literal mesmo da palavra eficiente. Tá ótim",jack_pearson,nao_inferido,nao_inferido,nao_inferido
