cluster_label,auto_label,rank,similarity_to_cluster_centroid,chunk_id,doc_id,excerpt,projeto,publico,marca_foco,tipo_sessao
km_000,presente / dar / gosta / comprar,1,0.7053542137145996,doc_0a02c0b1be74620a_pp_ch_0008,doc_0a02c0b1be74620a,"É, nessas percepções do que a pessoa já gosta é sempre mais legal, né? Mas você, quando você dá esse presente, por exemplo, esse exemplo que você deu das flores, né? Você tem alguma expectativa? Você tem algum você espera algo também? Você sente que você consegue nomear alguma expectativa quando você tá entregando esse presente pra ela ou enfim, pra outras pessoas também? Eu acho que assim, a minha expectativa é de ver a pessoa feliz, assim, eu acho muito legal você ver a pessoa recebendo presente e ficar contente com aquele presente, independente de você querer alguma troca por isso, né? Eu acho que é muito legal, né? E principalmente quando você dá presente, você sabe que a pessoa gosta daquilo ou quer aquilo, eu acho que é muito satisfatório. Muito legal isso. A sensação de acertar quase o presente, o que vai fazer a pessoa feliz ali naquele momento. Você falou sobre isso ser uma das partes mais legais de dar o presente, você acha que tem alguma parte chata, difícil de presentear? N",natura_3cs,consumidoras,natura,nao_inferido
km_000,presente / dar / gosta / comprar,2,0.6941989660263062,doc_d64503ab71e69ea1_pp_ch_0004,doc_d64503ab71e69ea1,"Eu disse, quando eu for lá, eu vou levar vasinho, uma planta, sei lá. Eu gosto. Bacana. Então você atrela essa presenteabilidade muito como agradecimento, gesto de afeto. Tem algum outro significado para você, o ato de presentear? Acaba que eu gostaria de ser presidenciada, então eu acabo que faço porque eu gosto, eu assim valorizo essa ação, sabe? E eu acho que também porque a minha mãe é assim, aí a gente vai sendo criado assim, acaba que passa, né? Não, perfeito. E você tem, geralmente, algum tipo de presente que você costuma dar, né? Você falou, pra uma casa eu gosto de dar vasinho, uma flor. Tem algum perfil mais ou menos, sei lá, se é aniversário de uma mulher, de homem, de uma criança, ou, não sei, Natal, Dia das Mães, qualquer coisa assim, você tem algum perfil específico? Não, sei lá, vou comprar presente pra uma mulher, independente da ocasião, é sempre na loja X, ou produto, por exemplo, uma flor, ou não. Você gosta de personalizar, né, pra cada dos seus presenteados. Assim,",natura_3cs,consumidoras,natura,nao_inferido
km_000,presente / dar / gosta / comprar,3,0.6709597110748291,doc_0a02c0b1be74620a_pp_ch_0007,doc_0a02c0b1be74620a,"Legal. Você falou aqui de algumas ocasiões específicas, né? Você acha que você dá mais presente nessas datas que estão dadas, ou você percebe que tem outros momentos que você também consegue presentear meio sem motivo? Então, minhas irmãs, elas costumam me presentear também, né? A gente tem uma relação muito boa, graças a Deus, né? Entre irmãos. Então, as minhas irmãs, às vezes, elas vêem alguma coisa como pra mim, então, às vezes, eu também costumo. Uma vez, eu tava até passando no shopping, eu não lembro qual, passando ali, comprei creme pra minha irmã, que eu sabia que ela gostava. Então, sempre que dá, eu costumo, mas é mais, na verdade, é mais no aniversário natal mesmo, né? Mas às vezes você vê alguma coisa que a pessoa gosta, aí eu acho que não tem problema você comprar também pra agradar. Tem esse olhar de uma oportunidade também de quando você lembra, né? Pra além do... Certo. No fim, você comentou, você falou sobre agradar, né? Às vezes você compra presente pra agradar. Você ",natura_3cs,consumidoras,natura,nao_inferido
km_000,presente / dar / gosta / comprar,4,0.664280116558075,doc_44982372dd74c6da_pp_ch_0025,doc_44982372dd74c6da,"Mas assim, de mim, já é natural. Às vezes eu vou sair de casa com a minha namorada para nós. Para que você vai se imprectar assim? Mas você já me conhece? Quer dizer, eu não consigo colocar só uma bermuda e o chinelo, uma camiseta e no shopping. Eu gosto de colocar uma calça, camiseta, perfume, às vezes relógio. Entendeu? E aí, e aí eu fui criando esse laço com as marcas, né? Então as marcas de grife, eu conheço praticamente todas. Todas, todas. Balmain também. Que eu conheço. E você falou que você gosta muito de moda e tudo mais, faz essas pesquisas para você. Quando você pensa em dar presente para alguém, você costuma fazer alguma pesquisa, buscar ideia, buscar referência de presente? E onde? Se você faz isso, onde você busca? Depende do estilo, por exemplo. A minha namorada tem uma religião, a religião espírita. Então, eu sabia que ela queria ganhar... Perdão, não sabia que ela queria ganhar, mas eu falei, vou dar presente arriscado. Que era dar uma escultura. E aí eu falei, meu, nã",natura_3cs,consumidoras,natura,nao_inferido
km_000,presente / dar / gosta / comprar,5,0.6632000207901001,doc_11e122f8db3f0253_pp_ch_0003,doc_11e122f8db3f0253,"Que legal! Até quando não é, eu levo alguma coisinha, sabe? Pra agradar a pessoa, sabe? Eu gosto bastante de presentear, receber amigos em casa. E de presente, você falou que gosta de presentear e de dar de lembrancinha também. O que você costuma ver? O que você gosta de comprar? Eu entendo que são várias ocasiões, não são só nas datas importantes, digamos, Dia das Mães, Natal, Dia dos Pais. Quando você vai, você leva uma lembrancinha? Você procura sempre presentear? Você tem uma coisa fixa? Você procura diversificar? Olha, dependendo da pessoa que eu vou, Eu gosto sempre de prestar atenção na pessoa, sabe? Até quando tem... Por favor, dá exemplo aqui. Até quando tem amigo secreto, por exemplo. Eu pego uma pessoa que eu não tenho muito envolvimento e daí eu procuro stalkear, saber, perguntar para as pessoas próximas, sabe? É o que ela gosta. Mas, normalmente, acessórios, cremes hidratantes, ou coisas pra casa da pessoa, sabe? A não ser quando eu conheço mais a pessoa, daí eu dou alguma",natura_3cs,consumidoras,natura,nao_inferido
km_001,pele / propagandas / mulheres / transmite,1,0.6899746060371399,doc_c1b714ce1513e838_pp_ch_0008,doc_c1b714ce1513e838,"O que mais que transmite quando a gente olha para essas propagandas? Josiane, o que transmite para você essas propagandas? Não tem idade, né? A pessoa assim, tanto jovem como mais pessoas idosas, pode utilizar ele que dá o resultado, né? Principalmente porque com o tempo a gente vai perdendo a elasticidade da pele, na elasticidade, mas tem que usar antes de perder a elasticidade, né? Já tem que começar a usar logo. Não deixar para quando já estiver cheia de rúga, tem que ter a prevenção, né? De cara na foto, eu sinto que é uma marca inclusiva, porque ela mostra... Nessa foto, por exemplo, tem uma asiática, uma negra e uma senhora mais branca. Então, ela remete à ideia de que é para qualquer mulher, qualquer tipo de mulher, não uma mulher em específico. Essa é a primeira imagem que me passa a propaganda. E o que você acha disso? É ótimo, porque antes, quando a gente via essas propagandas, mostrava sempre mulheres brancas, bonitas, padrão modelo, e nem sempre é o padrão que usa. Aqui são",gaia_ii,nao_inferido,nao_inferido,nao_inferido
km_001,pele / propagandas / mulheres / transmite,2,0.6755765080451965,doc_d42528cd9f4f9278_pp_ch_0010,doc_d42528cd9f4f9278,"Tá bom. Sim. Então, olhando aqui para essa imagem. Então, tem várias propagandas aqui de uma marca. E eu quero que vocês me contem aí o que essas propagandas transmitem, quais são os sentimentos, as emoções que elas despertam, que mensagens que ficam quando a gente olha para esse conjunto de propagandas dessa marca. Podem ir falando, tá, meninas? A juventude... Oi, desculpa? Mota bem como a gente falou da diversidade de peles, né? Onde que a gente vê isso, Jasmine? Essa questão da diversidade de peles? A gente tem uma senhora branca, a gente tem uma asiática, a gente tem uma mulher negra, a gente tem uma jovem com a pele branca. Tem uma parda. Tem uma parda. Quem falou juventude? A primeira que falou juventude, Gi? Me conta aí, onde que a gente vê juventude? Eu falo assim que em si mostra os produtos e a forma como a pele é mostrada nas imagens, traz a sensação de juventude, de manter a pele jovem, a pele macia, brilhante, hidratada. E a gente vê até por aquela senhora que tá ali do ca",gaia_ii,nao_inferido,nao_inferido,nao_inferido
km_001,pele / propagandas / mulheres / transmite,3,0.674027681350708,doc_1cecf4bbb8f06cf1_pp_ch_0009,doc_1cecf4bbb8f06cf1,"Ela não deixa de ser sofisticada, mas ela também tem uma leveza. É mais como a nossa colega falou, é mais moderno, dá ar de moderno. Onde que está esse ar de moderno, Silvana? No design da embalagem, essa embalagem mais alongada aqui, desses dourados ali, do azul também, elas são mais altas. Uma sofisticação também na embalagem. Quantas mulheres? O que elas passam, que relação vocês estabelecem com elas aí, o que elas transmitem? Confiança, elas são mulheres muito confiantes. Pele brilhante, pele iluminada, pele bem cuidada. Até a pele dessa mais aqui da esquerda, onde está o Regener, até a pele dela é linda. Então, me mostra que é produto muito bom. Sim, sim, mostra uma pele madura e bem cuidada. Ela tem ali os pezinhos de galinha, ela tem as marcas de expressão dela, mas, no entanto, uma pele viçosa, uma pele bem cuidada. E... E as mais jovens aqui do lado direito, como a Priscila falou, elas transmitem uma autoconfiança de mulher, tipo, eu me cuido. Entendi. Vamos completar a frase.",gaia_ii,nao_inferido,nao_inferido,nao_inferido
km_001,pele / propagandas / mulheres / transmite,4,0.6664645671844482,doc_40a5bd913d6434d3_pp_ch_0012,doc_40a5bd913d6434d3,"E você, Mara? Olha, eu também me identifico com a foto das três mulheres de diversas idades, e mostra que elas têm cuidado especial para a pele, e o brilho, o rosto, você vê que está muito bem tratado. Onde a gente percebe esse rosto bem tratado? Porque ele tá com brilho, tá uniforme, né? Muito bem. Então, a gente vai fazer mais o que a gente fez na outra, tá? As propagandas de Cronos me transmitem o quê, Suzana? Em uma palavra. Qualidade. Qualidade. Confiança, ela é uma marca que já está no mercado já há anos, né? Renovação em que sentido, Eda? Que vai me deixar a minha pele bonita, vistosa. Vou mostrar mais uma, e aí eu quero que vocês Façam o mesmo exercício, olhem e me contem as impressões que essas propagandas estão passando. É uma marca maravilhosa também. Tem valor pouco elevado, né, se tu comparar com Natura, com Avon... Mas isso, as propagandas passam essa ideia de ser valor elevado ou a experiência que você tem com essa marca que... É a experiência que eu tenho. Adquirido, já",gaia_ii,nao_inferido,nao_inferido,nao_inferido
km_001,pele / propagandas / mulheres / transmite,5,0.6650136709213257,doc_1cecf4bbb8f06cf1_pp_ch_0006,doc_1cecf4bbb8f06cf1,"Fala Silvane. Para mim aqui, essa leveza, essa embalagem mais clean aqui, dá a impressão que é produto já para limpeza de pele, e esse outro aqui mais sofisticado, que fica bem aqui no meio, com essa tampinha dourada, ela já transmite cuidado maior com a pele, embalagens práticas, Me conta uma coisa. Na verdade, agora vocês vão completar a frase para mim, tá? As propagandas de clinique me transmitem o quê? Em uma palavra. Que palavra você usaria, Silvani? Leveza. Priscila? Praticidade. Eu vou mostrar agora de outra marca e a gente vai fazer a mesma coisa. Espera só pouquinho. A minha queridinha. Vamos olhar. E aí o que eu vou pedir pra fazer? Eu sei que vocês são consultoras Natura, mas eu vou pedir só pra vocês separarem pouquinho do papel de consultoras agora, olharem pra essas imagens e me contar o que elas transmitem. Olhando pra elas, que mensagem, assim como vocês fizeram com o Clinique, que mensagem que passa, olhando pra essas mulheres, que mensagem que fica, que relação que a ",gaia_ii,nao_inferido,nao_inferido,nao_inferido
km_002,loja / boticario / presente / natura,1,0.6668484807014465,doc_7c1dc7dcc6ddc2d7_pp_ch_0003,doc_7c1dc7dcc6ddc2d7,"O que vocês se lembram aí de importante para a categoria de perfumaria que vocês observaram nessas três lojas que vocês visitaram? Como você quer fazer? Estamos contando? Estamos contando. Bom, eu acho que assim, logo de cara, o que chamou muita atenção pra gente de Boticário vs Natura foi a localização das lojas, né? Acho que a gente foi em lojas que eram bem perto umas das outras, a gente foi até a pé de uma pra outra, assim. Era lá no Centro Histórico de Porto Alegre e a localização da loja do Boticário era mil vezes melhor, era bem na [ENDERECO], assim, onde passavam os carros e a natura, além de ser dentro de uma Como que chama? Tipo uma galeria, né? Complexo de lojas, assim? Então era dentro de coledor. Era bem escondidinho, assim, então logo de cara a gente já achou a loja do Boticário bem mais convidativa, assim, pra você entrar, né, se realmente você tá procurando alguma coisa. A gente achou mais convidativa a loja do Boticário. Desculpa, te interromper. Você falou da localiza",3cs_perfumes,nao_inferido,nao_inferido,entrevista_em_profundidade
km_002,loja / boticario / presente / natura,2,0.6615354418754578,doc_b5d06e16e286306b_pp_ch_0017,doc_b5d06e16e286306b,"Todas, exatamente. Talvez a mais fraca foi a do. Boticário, nesse sentido, mas eu não acho que isso seja regra, assim. Foi uma experiência pontual, porque a gente já sabe que o Boticário manda muito bem na questão do atendimento e tal, entendeu? Mas o encantamento, assim... E ainda assim o encantamento aconteceu porque a gente experimentou os produtos em si, assim. A gente foi cheirando e foi testando, então acontece em alguma medida, né? E mesmo que a gente quisesse driblar o não-atendimento do Boticário, tinha lá o QR Code que a gente poderia ser guiado em alguma medida também. Tem ali também algum artifício que, se você não estiver sendo guiado pela vendedora, a loja proporciona, não é isso? É, tipo, dribla. Por exemplo, se está muito cheio, alguma coisa assim, provavelmente as pessoas usariam. Eu até entrei depois, Mari. Tipo, o link fica... Dá para a gente entrar. Até depois eu entrei para ver como funciona e tal, exatamente isso, você coloca o camilfativo que você gosta, alguma c",3cs_perfumes,nao_inferido,nao_inferido,entrevista_em_profundidade
km_002,loja / boticario / presente / natura,3,0.6434941291809082,doc_9e6379543f294d71_pp_ch_0007,doc_9e6379543f294d71,"No Boticário não me apresentaram nada de extensão de linha. Que até a gente me chamou a atenção, porque... Esse é ponto de diferença também, Mari. Isso da primeira loja que a gente foi, do Boticário, que era nesse shopping que o Fabrício comentou, que era tipo uma galeria, shopping mais classe C, assim, mais popular. Só que quando a gente foi no outro shopping, que já era mais classe AB, e a gente não tinha que visitar o Boticário, mas a gente foi porque já estava lá, lá eles oferecem mais kits. O vendedor tentou explorar muito mais essa parte de kits comigo do que nesse shopping mais popular. Essa é uma diferença entre as lojas. E também entre o Boticário mais popular e o Mais Classe A.B., teve uma diferença de linhas apresentadas. Achei que no popular ela tentou explorar mais os best-sellers mesmo, E no de classe A B, achei que eles tiveram uma conduta mais para os kits. Então, o que tinha kit montado, ele falava mais sobre a perfumaria, que era a glamour, por exemplo. Eu acho que fo",3cs_perfumes,nao_inferido,nao_inferido,entrevista_em_profundidade
km_002,loja / boticario / presente / natura,4,0.636886715888977,doc_9e6379543f294d71_pp_ch_0004,doc_9e6379543f294d71,"E pra você, Ana? A minha experiência foi pouquinho diferente da do Fah. Eu achei que as lojas não se diferenciam muito, realmente. A experiência de compra é bem parecida. Eu tive algumas diferenças só entre uma loja e a outra, que eu vou citando. Mas em termos de expertise, achei que as duas vendedoras não são expertas em perfumaria, elas acabam entendendo pouquinho mais do portfólio das marcas que elas trabalham. Então, assim, diferente do que a gente ouve e vê, né, e conversa com as pessoas, por exemplo, na Sephora, que eles são treinados para falar sobre perfumaria como todo, são experts nisso, né. Eu não percebi isso nas lojas da Natura e do Boticário, tá, não existiu isso. Eu fui com papel muito de leiga da categoria mesmo, de tô aqui, não sei nem explicar o que eu gosto. Então, a abordagem foi semelhante a da do Fabrício, né? Quando você entra na... Mas que tipo de perfume você gosta? Aí eu falei, eu tenho essa dificuldade de falar qual tipo de perfume eu gosto. Eu gostaria mais ",3cs_perfumes,nao_inferido,nao_inferido,entrevista_em_profundidade
km_002,loja / boticario / presente / natura,5,0.6365090012550354,doc_1d7aeba5c3deb241_pp_ch_0034,doc_1d7aeba5c3deb241,"E eu trabalho com novas marcas e multi-categoria, então eu acabo interagindo bastante com o pessoal do varejo, porque eu acho que esses insights seriam muito importantes, depois da Natura, que da nossa, né, do Intel, enfim, o dono do projeto, compartilhar com o varejo, porque eu acho que tem muita coisa rica pro varejo da Natura. E, assim, o que nos chamou a atenção é que, assim, Então assim, a loja da Natura era duas vezes o tamanho da loja do Boticário, então uma metragem quadrada bastante significativa, bem maior. A gente tinha menos perfumes no portfólio da Natura, na loja da Natura, do que na do Boticário. Não tô dizendo se isso tá certo ou errado, tá? São fatos. A vendedora, quando o perfume, a perfumaria de uma marca XYZ não está dentro da gôndola perfumaria natura, ela não contempla aquilo como categoria perfumaria. Pra mim isso é super learning, tá? E botei meu chapéu de marketing agora e não de mystery shopper. Como que a gente, como Natura, tem que fazer o replique do SKU no",3cs_perfumes,nao_inferido,nao_inferido,entrevista_em_profundidade
km_003,refil / embalagem / parece / formato,1,0.6743910908699036,doc_d7948b6302ad2fee_pp_ch_0040,doc_d7948b6302ad2fee,"Então não é a visão atual. O que vocês falaram? Não é a visão atual. Se não tivesse rótulo, a gente poderia... Facilmente comparar com uma marca importada. Então tá parecendo uma marca importada. É upgrade. Mas aí é parte do design, né? Isso, o formato. Então vamos para a última, gente. Agora a gente vai ver. Nossa, que linda! O formato vai ser esse assim, eu não sei... Esse aqui, vamos pensar assim, sempre esse aqui que eu tô mostrando pra vocês, ele é o hidratante, né? Tem esses outros formatos aqui também. O refil que a gente já tinha visto, né? Eu adorei! E aqui... Eu preciso dizer para vocês que as cores mudam conforme a linha, tá? Então tem uma coisa de mudança de cor aqui, tá? O que vocês gostaram aqui? Eu gostei de tudo. Eu gostei de tudo. Eu gostei da embalagem que é muito mais natural e sofisticado do que qualquer outras E é totalmente diferente. Totalmente diferente. O que é isso de totalmente diferente? Formata sempre quadrado, arredondado, oval. Agora com essas pontas, não",anima,nao_inferido,nao_inferido,nao_inferido
km_003,refil / embalagem / parece / formato,2,0.6651965975761414,doc_d7948b6302ad2fee_pp_ch_0026,doc_d7948b6302ad2fee,"Dá pra se reutilizar muito. Ele é mais resistente. Isso é bom? Sim. Porque aí eu acho que instiga mais ainda o consumo do revivo. Não parece que a gente tá consumando. É bem diferente. Não parece mesmo. Pensando bem, eu gosto de colecionar potes, coisas assim. Eu guardaria numa boa, queria ter mais. Dá para fazer uma arte, né? Bem sofisticado o material, mas dá para. Fazer uma arte dele, né? Tipo a Stieke pega esse tipo de coisa. A Stieke pega outro personagem. Isso é interessante. Vocês acham que vai estimular o consumo do refil porque dá uma cara de mais resistente, de melhor qualidade nesse sentido? Sim, depois que a gente pegou essa talidade. Porém, lembrando que por mais que ele é bem resistente, só que Se for pra descartar, igual a gente descarta o outro, eu acho que outro aproveitamento pra reciclagem é melhor do que esse daí, eu acho. É uma preocupação ambiental. É uma preocupação ambiental. Como que vai ser a reciclagem desse? Ainda que vocês vivem no globo afofo. Uma florzinh",anima,nao_inferido,nao_inferido,nao_inferido
km_003,refil / embalagem / parece / formato,3,0.6472638249397278,doc_2ea20bb0263aff60_pp_ch_0010,doc_2ea20bb0263aff60,"Sabe, eu conheço, shampoo, condicionador, sabonete, eu quero dar sabonete, a gente vai, esses líquidos, a gente vai falar pra eles, mas uma embalagem tão simplesinha... Pra dar de presente. Agora vai ficar excelente. Que legal. Agora vai ficar mais presenteável. Com certeza. Muito bom, gente. Tem alguma coisa que incomoda vocês? Não. Não? Lembrando que a embalagem vai ser naquele formato lá, que tá do lado de cá. Não, formato não, material. É porque a gente não tá nem tocando, então a gente tá só ouvindo. Então pra mim é isso. Material é isso. Esse aqui é levinho, esse aqui é pesadelo. Essa é a referência. Sim, e o hidratante. Pode ser isso. Então vai ser uma coisa muito linda. Vai ficar o quê? Mais linda. Vai ficar mais linda. Legal. Vocês acham que tá novo, diferente? Sim, muito. Vai ser boom. Vai ser boom? Porque é bonito, olha só. Bem bonito. Legal. Combina com o Ecos? Esse visual. Lembra, aqui é a nossa principal diferença, que a gente tem o conjunto. Isso aqui é só para vocês con",anima,nao_inferido,nao_inferido,nao_inferido
km_003,refil / embalagem / parece / formato,4,0.6435239315032959,doc_2ea20bb0263aff60_pp_ch_0035,doc_2ea20bb0263aff60,"Eu não vou nem olhar. Essa aqui é sempre igual, né? A do refil, é. O refil é a gotinha da. Bom, agora a gente vai complicar mais a história, hein? O que eu vou fazer? Vou trazer outros acabamentos pra esse mesmo design, tá? É esse formato aqui, só que eu vou trazer outros acabamentos além do cerâmico. O que a gente fez não? Vai complicar a cabeça da gente. Já complicou, né? Já tá complicada. Já tá complicada. Esse aqui é o ANF. O que vocês acham? Tá vendo? Mesmo visual, mesmo formato. Como acabar o fosco no fosco. Exatamente. E aí, o que passa? Mais bonito. Que mais? Esse combina com a ECOS também. Combina com a ECOS. Que mais? É lá fora? Não curtiu não, por que você não curtiu? Me falou, você não curtiu? Não, você já entrou no Brasil e. Não quer ir embora e faz drogas e coisinhas. Você é tímida. Porrifador de água, tipo de ópera de passar roupa. Existem uns porrifadores redondos. É pior que eu não tinha pensado agora você colocou. Esse é o pior. E ele tem escusco também? Eu não ia fal",anima,nao_inferido,nao_inferido,nao_inferido
km_003,refil / embalagem / parece / formato,5,0.6402860879898071,doc_ac743f4f09e1e58c_pp_ch_0034,doc_ac743f4f09e1e58c,"É esse aqui que passa para o potinho de tempero? É o conjunto. O conjunto, o potinho de tempero, tá bom. E aí o ANF, o que ele passa? Ele é mais neutro. Ele não tá feio por causa da cor do produto. Mas é o produto que se torna feio. Tá bom. Pode tomar. Mas ali o conjunto também ganha cor, né? Essa coisa do fosco, ela me remete a uma coisa meio tecnológica talvez, o que não é o que a natura comunica. Então me parece que são conceitos que se divergem. Mas ainda assim eu gosto dela. A ANC, me parece que ela representa a natura na essência, assim. Ela entrega a natura, assim. É a cara da natura. Os outros, o ANA e o ANB. Eles não entregam nada que a gente já não veja na boticário, numa farmácia qualquer, né? Não tem nada de mais. Mas os outros dois, sim. E principalmente o ANC. Eu acho que se eu pudesse resumir, acho que é isso. Esse ANC entrega a essência do que é a natura. Vocês concordam? Muito bom. Essa foi só a primeira. Então, aqui, o pessoal que deixou bem claro ganhou o ANC, né? E ",anima,nao_inferido,nao_inferido,nao_inferido
km_004,mae / casa / filho / cuidar,1,0.6176161766052246,doc_813751e4679e395b_pp_ch_0010,doc_813751e4679e395b,"Eu cuido da minha saúde, eu vou sempre à academia, eu vou todos os dias à academia, eu faço terapia uma vez por semana, tava fazendo duas, mas agora cortei pela metade, tô fazendo uma por semana, eu vou muito ao médico, faço check-ups, enfim, cuido muito da minha alimentação, cuido muito não só de mim, mas também do planeta em si, reciclo o lixo, enfim, tudo isso. Mas será que todas essas coisas que colocaram na gente também, isso não é fardo? Porque a gente tem que cuidar da gente. Eu gosto. Eu gosto. Não, eu não tô falando que a gente não gosta, não, mas é mais checklist, né? É, acho que se todo mundo fizesse isso, né? O mundo seria bem melhor e as pessoas seriam bem melhores, né? Eu digo muito pro meu terapeuta, se todo mundo fizesse terapia, o mundo seria muito melhor, né? E e a gente faz terapia pra conseguir lidar com as pessoas que não fazem, né? E essa é a realidade do mundo hoje, né? Eu digo que é o dinheiro mais bem gasto que eu tenho no mês. Você trouxe essa questão do memen",biome,nao_inferido,nao_inferido,nao_inferido
