cluster_label,auto_label,rank,similarity_to_cluster_centroid,chunk_id,doc_id,excerpt,projeto,publico,marca_foco,tipo_sessao
km_004,mae / casa / filho / cuidar,2,0.6018055081367493,doc_399dacb2736f0f29_pp_ch_0033,doc_399dacb2736f0f29,"E aí, quando a gente pensa nesse bem-estar e nesse papel de mãe, o que esses momentos da gente com o marido, da gente namorando, sem os filhos trazem pra gente? Como é que eu posso dizer? A gente fica... A gente vai se anulando, né? Na maioria das vezes é isso, né? E a gente tá sempre funcionelhos, né? Gente... Eu sigo uma mulher no Instagram que ela diz assim, essa questão do malabarismo que a moça falou, ela fala de pratinhos, né? Que é o pauzinho rodando no pratinho, assim, dela sempre diz assim, que chega no final de ano e ela diz assim, ai, qual pratinho eu vou deixar cair hoje? E eu tenho minha consciência bem tranquila, não sou uma máquina, não consigo dar conta de tudo, às vezes meu marido quer me cobrar alguma coisa assim, eu digo, ai não, Fica em função do nenê, ele correndo pela casa toda. Eu digo, não tem como. Eu faço conforme eu dou conta. Fico bem tranquila. Eu queria perguntar também para vocês, como é que os filhos recebem esses momentos? Como é que os filhos, as pesso",bem_maes,nao_inferido,nao_inferido,nao_inferido
km_004,mae / casa / filho / cuidar,3,0.5986256003379822,doc_813751e4679e395b_pp_ch_0006,doc_813751e4679e395b,"Eu acho que eu percebo uma mudança muito grande entre pré e pós pandemia, porque a gente tinha aquele hábito, pelo menos, mesmo quem trabalhava remoto, de horários mais fixos, pouco mais de... Tato das pessoas também dos horários e saber limitar pouquinho mais a... O business hours nas horários comerciais, acho que isso a gente perdeu muito e mesmo vendo, eu estava percebendo esses dias, apesar de estar trabalhando de casa, eu saí e como moro aqui em Pires, tem muita empresa, eu vi que as pessoas voltaram bastante para o escritório, mas eu acho que ainda esse limite, esse mindset de a gente ter pouco segmentação entre as nossas várias facetas da vida meio que ficou nublado e muita gente ainda tem dificuldade de entender que é necessário a gente ter esses momentos de, não, não estou trabalhando. Então a gente acha que ainda a gente tem que voltar a encontrar qual uma outra dinâmica, qual uma outra equação correta nesse momento. Eu acho que é exercício, acho que vai ser da humanidade, nã",biome,nao_inferido,nao_inferido,nao_inferido
km_004,mae / casa / filho / cuidar,4,0.5982142686843872,doc_399dacb2736f0f29_pp_ch_0017,doc_399dacb2736f0f29,"Você trouxe duas coisas que eu queria abrir, inclusive, pra gente discutir. Você falou antes, quando o tempo não era assim, né? Vocês percebem também essa mudança? Sim? Conta pouquinho pra mim o que vocês acham que essa mudança trouxe, né? E por que houve essa mudança? Contem pouquinho pra mim. Tem gente que tá com o microfone fechado, aí eu não consigo ouvir. Se a gente pensar hoje nessa questão da gente buscar ser mulher, buscar a individualidade, porque é pouco o que vocês estão trazendo, não ser só mãe, eu também no meu papel de mulher, o que é isso? Qual é a diferença que vocês percebem que isso faz diferença na vida da gente enquanto mãe? E se sim, que diferença é essa? Entendeu? Faz uma diferença total. Eu não vou lembrar o nome dela agora. Que estava falando antes, a gente precisa cuidar primeiro da gente para estar bem para cuidar do outro. Eu acho que algumas pessoas, na verdade, trouxeram essa fala. E a amiga falou, poxa, eu tenho uma rede de apoio. Hoje é sexta-feira, o meu",bem_maes,nao_inferido,nao_inferido,nao_inferido
km_004,mae / casa / filho / cuidar,5,0.5977326035499573,doc_399dacb2736f0f29_pp_ch_0010,doc_399dacb2736f0f29,"A gente vai priorizando os filhos, né? Toda a rotina que é a maternidade em si. E sempre falar do desgaste, e a gente vai se deixando de lado. E não é assim. Pra gente cuidar e estar bem, cuidar dos filhos e da família no geral, a gente tem que estar bem consigo mesma. Então a gente tem que se priorizar sempre se botar como prioridade. Quando a gente se bota como prioridade, nesse sentido que você está falando, O que isso traz pra gente? O que isso traz pra nossa relação com os filhos? É autoestima, né? Não é só ir no salão, acho que até brinco, né? A gente não ficar só de pijama, Porque eu sou [NOME], né? Mas a gente colocar uma roupa diferente, né? Brinco que seja, se maquiar, a. Gente já sente diferente, né? Se sente como, Fernanda? Sente bem, né? Sabe que tá se cuidando, né? A Janaína escreveu, aconchego segurança escolhida. Me fala. Aconchego pra mim é aquele hélio, né? Aquele momento quentinho, juntinho, segurança, nos sentamos em segurança. Eu coloquei também escolhida, porque s",bem_maes,nao_inferido,nao_inferido,nao_inferido
km_005,natura / clientes / vende / cliente,1,0.6255764961242676,doc_1434a07027866aa7_pp_ch_0012,doc_1434a07027866aa7,"É porque é muito ruim, né? Se não... Aí você vende e não tem o produto, você acaba não vendendo, né? Isso, exatamente. Os kits mesmo, os kits mesmo da Boticário, Eu tinha CGL Chocolate, eu tinha vendido bastante. Quando vou lá pedir, não tem. E não tem nem previsão de quando vai chegar. Já a Natura, o bom é que, tipo assim, a nossa líder mesmo, sempre elas falam, né? A gente tem grupo, elas falam, ó, voltou, esse não vai ter, tem plano B. E aí a gente vai esperando, quando tem tudo o que tem, o que a gente quer, aí a gente faz o pedido, entendeu? Já o vodcário não é a mesma coisa. Se você normalmente consegue vender os kits cheios, você falou que às vezes você convence as pessoas ou você compra e depois você separa os produtos. Como é que você faz? Na verdade, se eu vi que eu vendi, vamos supor, uns três kits de cada kit que tem do Dia das Mães, eu sempre acrescento mais dois desses, dois desse e já deixo aí para a pronta entrega. Tá, mas o consumidor ele compra o kit todo? Ou algumas ",natura_3cs,consultoras,natura,nao_inferido
km_005,natura / clientes / vende / cliente,2,0.6084972023963928,doc_1434a07027866aa7_pp_ch_0011,doc_1434a07027866aa7,"Vamos supor, tem vezes que eu tenho só duas unidades de amostra. Aí eu falo, não posso te dar esse, mas eu te dou essas outras amostras, mas esse daqui eu não tenho mais. Aí eu falo, então tá bom. Só que ela sente o cheiro do novo perfume e tá bom, ela fica de boa. Você demonstra além das amostrinhas? Não, eu não abro produto, porque é muito difícil para mim vender, entendeu? Depois é muito difícil, eu prefiro dar essa amostra mesmo. E o que costuma, as pessoas presenteiam, te procuram para presentear, mas em qual ocasião? Tem alguma mais nas datas, comemorativas, o ano todo, como é que é? Bom, sempre eles, não, qualquer data eles pedem mesmo, para aniversário, ou dia das mães, eu vendo bastante cada dia das mães, dia dos pais, dia dos namorados mesmo, Natal, essas coisas, eu vendo bastante kits. Mas eles sempre levam para aniversário, levam bastante coisa também. Rebeca, você acha que dessas marcas que você vende, por exemplo, Avon, Natura, Boticário, Eudora, existe uma preferência do",natura_3cs,consultoras,natura,nao_inferido
km_005,natura / clientes / vende / cliente,3,0.6082648634910583,doc_1434a07027866aa7_pp_ch_0009,doc_1434a07027866aa7,"Não, eu já sou bem sincera com elas. Ou como elas me perguntam, esse daqui é bom? Elas falam. Ele é bom. Eu vendo bastante perfume mais amadeirado, cítrico. Doce, doce, eu não vendo muito. E eu também, tipo assim, pra mim, usar doce é difícil. Porque eu tenho rinite e ataca rápido. Você vende mais o que você gosta, porque as pessoas te pedem indicação e você indica o que você gosta, é isso? Travou pra você, Lu? Oi! Voltou. Voltou. Tinha dado uma travadinha. E, Rebeca, me conta uma coisa. Quando você vende pra presente, você já embala o produto numa embalagem? O que você usa de embalagens pra embalar o presente? Sacolinhas. As sacolinhas que eles... Que a natura mesmo. Você gosta das sacolinhas da Natura? Rebeca, tira do... Oi. Oi, agora foi. Você gosta das embalagens da Natura? E aí você compra elas à parte ou são as sacolas que vêm com o presente? Não, eu compro também e o que vem nos kits também. Tá. Legal. E aí quando alguém quer ter presente, normalmente eles chegam para você e fal",natura_3cs,consultoras,natura,nao_inferido
km_005,natura / clientes / vende / cliente,4,0.6006332635879517,doc_1434a07027866aa7_pp_ch_0006,doc_1434a07027866aa7,"E assim você precisa a cada revista nova dessas marcas. Você precisa mandar para os seus clientes e para esperar retorno ou hoje você depois desses dez anos já trabalhando com isso você considera que assim já já meio que automático assim os clientes já sabem que a Rebeca vende e já te procuram. Sim eles. Se eles mesmos me procuram bastante porque como posso te falar é que eu vendo bastante a Natura por qual motivo? Tem clientes que eles pegam bastante kit e elas sempre falam assim para mim, Rebeca quando aquele kit estiver pronto me avisa, tá bom, dá para parcelar? Dá. E eu parcelo. Porque eu já vi que outras revendedoras entregam produto hoje, uma semana já estão cobrando, né? E caso que, tipo, a cenatura, não é assim, né? Eu espero, eu falo, se você comprar esse valor acima de 100, eu parcelo pra elas, eu falo, as datas são boas. E eu sempre faço uma, como posso falar, uns pedidos sempre depois do pagamento ou do baile. Pra assim não me atrapalhar, nem atrapalho elas. Então você faci",natura_3cs,consultoras,natura,nao_inferido
km_005,natura / clientes / vende / cliente,5,0.5967742204666138,doc_5e6540144b9030fe_pp_ch_0007,doc_5e6540144b9030fe,"Isso você acha bom. Acho maravilhoso. Muito bom. Você acha bom o fato, por exemplo, da Natura você conseguir tirar os produtos, ou você não acha? Isso, eu acho maravilhoso porque eu compro o produto, eu compro o kit, aí eu não vendi aquele kit naquela data especial, eu vou separar, isso, aí eu vendo ele avulso, aí eu vou ter caixa guardada, eu tenho bastante caixa da Natura guardada. É porque às vezes a pessoa quer só produto daqueles três que tem ali ela não quer todos aí eu vendo só aquele produto então já desmembrou já não é mais kit então a caixa fica guardada. Então quando me compram é produto da natura é kit da natura eu sempre tenho caixa porque eu tenho bastante do tempo que eu vendo tem bastante caixa do boticário já é raro eu ter eu não tenho não tenho caixa de presente que eles não mandam tem que comprar e eu não compro. É só quando tem o kit pronto mesmo. Mas as pessoas, você prefere que venha aberto? As pessoas gostam quando vem fechadinho da Natura, do Boticário assim? Ou",natura_3cs,consultoras,natura,nao_inferido
km_006,papo / nome / comecar / bate papo,1,0.72261643409729,doc_012fe174842b390e_pp_ch_0001,doc_012fe174842b390e,"Oi! Tudo bem? Eu também e você? Tudo jóia! Que bom! Estamos chegando aqui, acho que o Dani e a Dani, né? São dois Danis, o Dani e a Dani já estão chegando também e a gente começa a conversar, você tá bem? Eu sou a [NOME], eu tô esperando pouco a convidada nesse momento, ela entrou mas ela saiu. O Taís e a gente fala que. É da Kira também, né? Isso, isso. Normalmente eu tô apresentando vocês, né? Só que meu teto tá supravada. Você tá travada, Paula, mesmo. Nossa, eu vou tirar uma foto sua, calma aí. Deixa eu tentar ficar 120 graus e ver se melhora. Olha o Willen, gente. Nossa, não continua a travar. Eu tava Ana. Olá, boa tarde. Boa tarde, agora deu certo. Desculpa aí, não sei o que estava acontecendo não, porque eu costumo... A gente também teve pouquinho de dificuldade na hora que a gente tentou entrar, mas deu certo. Aquele dia que a tecnologia não está muito a nosso favor, né, gente? É verdade. O importante é dar tudo certo. Bom, Ana Lúcia, eu sou a [NOME], eu trabalho na Kira, que é",natura_3cs,consultoras,natura,nao_inferido
km_006,papo / nome / comecar / bate papo,2,0.7047898173332214,doc_52108ac94ef635f9_pp_ch_0001,doc_52108ac94ef635f9,"Não, vai ser só você nesse momento e o pessoal da minha equipe mesmo. É só bate-papo para vocês se conhecerem, você vai ver. Deixa eu ver se eles estão aqui. Não aparecem, deixa eu tentar mandar para eles o convite direto. Tá conseguindo. É cafezinho? Ai, gente! Eu bem queria, viu? Olha só, acho que as meninas estão aqui depois do almoço, né? Pedem cafezinho. É bom, né? Deixa eu ver se agora elas vão conseguir entrar. Sim! Oi, Priscila! Olá, gente! Olá, Priscila! Erika, me desculpe por ter seu nome. Com K, me perdoa no convite. Tá, tudo bem, não tem problema nenhum, imagina. Tudo bem, Priscila? Prazer. Tudo, prazer. Priscila, e seu nome? Prazer, Erika. Meninas, eu já contei de toda a dinâmica da pesquisa, já contei também sobre a gravação, então agora eu deixo vocês com a Pri, qualquer coisa eu tô por aqui, tá bom? Obrigada. Obrigada a vocês. Eu tô com pouquinho de problema no meu microfone, tava tentando resolver aqui. Vocês estão me ouvindo bem? Tá me ouvindo bem, Pri? Tô. Então tá ó",natura_3cs,consultoras,natura,nao_inferido
km_006,papo / nome / comecar / bate papo,3,0.6975557208061218,doc_d52d828ab53d85d0_pp_ch_0001,doc_d52d828ab53d85d0,"Só pra deixar ligado na tomada, tá? Isso, por favor. Perfeito. Thais, boa tarde, tudo bem? Oi Tamires, boa tarde, eu tô bem e você? Tudo jóia. Que bom, já estava conversando aqui com a Cecília, já apresentei todo o time também, falei que vocês estavam para entrar, estamos esperando a Mari por aqui. Tá bom. Acho que só a Mari vem nesse, né, o Ívio? Eu acho que ele não vai conseguir. Eu acho também, mas tudo bem. O importante é que vocês não dozem estado por aqui, conversando com ela. Eu vou te mandar uma pergunta no WhatsApp, tá? É isso. Mande-me, tá bom. Oi gente, voltei! Bora lá! Oi Siceneia! Tudo bem com vocês? Tudo jóia! Então tá bom. A Mari está ingressando aqui como palestrante. Oi, pessoal, tudo bom? Desculpa a demora. Oi, Mari. Boa tarde, tudo bem? Tudo bom. Tá meio barulhento aqui, eu não sei se vocês conseguem me ouvir bem. A gente consegue te ouvir, mas a gente consegue ouvir o barulho também, pouquinho de barulho. Eu vou... Eu falo e desligo o microfone para não ficar muito ",natura_3cs,consultoras,natura,nao_inferido
km_006,papo / nome / comecar / bate papo,4,0.692090630531311,doc_124f0c4d1195ab02_pp_ch_0008,doc_124f0c4d1195ab02,"Eu não pretendia, de lá eu já... A gente pode se encontrar lá, que eu vou ter que voltar mesmo. Tá bom. Ana, por você, tudo bem? A gente se encontra lá também, por mim, tudo bem. Tá bom. Depois a Thais disse que vai passar o contato dela e a gente combina com ela onde ela quer encontrar. Tá bom, beleza. Fechou. Sobre o papo de agora, gente, eu tô com roteirinho aqui de cola na minha segunda tela, e aí eu vou controlando aqui se a gente faz todas as perguntas, e aí se for o caso eu vou complementando, mas como eu falei mais cedo, eu fico aqui mais nesse trabalho de ir anotando, capturando as percepções, tá? Vamos embora. Só pra avisar que ela está entrando, tá? Ela teve problema com a chuva, ela foi deixar o filho dela na escola. Oi, Rafisa. Desculpa, perdão, tô toda molhada da chuva. Mas você tá bem? Tô bem, tô ótima, cheguei. Que bom, você consegue ver e ouvir a gente tranquilamente? Isso, todo mundo aí tá ótimo. Legal, Rafisa, eu me chamo [NOME], eu trabalho na Kira, a Mônica, a Anny",natura_3cs,consumidoras,natura,nao_inferido
km_006,papo / nome / comecar / bate papo,5,0.6902898550033569,doc_cda5ac0ca4bfa447_pp_ch_0004,doc_cda5ac0ca4bfa447,"Tá bom. A B também tá nosso grupo. Rosana, tá. A Deano, acho que ela não vai entrar, né? Mas ela tá nosso grupo, é isso? Ela faz parte do nosso... Eu entendi que... Até ontem não fazia, e hoje... É hoje que vocês colocaram ela, né, Thaís? É porque são duas... Ontem, ontem no final da tarde, é, A Polly... Então, ela faz parte do nosso grupo. Mas não que ela vá participar de todas as fases efetivamente com vocês. É, hoje, inclusive, tem uma reunião de elo, mas depois a gente fala. Ela até cancelou o GG porque tinha. GG esse horário, e aí foi por conta dela. Mas, gente, não significa que vocês não podem também falar, fazer alguma intervenção, algum complemento, tá, Tati? Pode, não tem problema nenhum, ainda mais se tiver, às vezes, alguma questão específica, super pode, tá? A Rosana chegou. Oi, Rosana, bom dia, tudo bem? Você está com o microfone mutado e ao lado desse do vídeo que você tá me escutando? Perfeito, obrigada, viu, Rosana, pela disponibilidade de conversar com a gente. Quem v",natura_3cs,consumidoras,natura,nao_inferido
km_007,pele / corpo / uso / gosto,1,0.7153638601303101,doc_ecbea0911b71e6fa_pp_ch_0019,doc_ecbea0911b71e6fa,"Eu gosto de passar mais nas minhas pernas, porque é o local, na minha canela, é onde resseca mais. Então, eu procuro hidratar mais. Como você faz isso para hidratar mais? Então, eu uso hidratante. E no inverno, eu costumo passar óleo. Tomo meu banho, com o corpo molhado, eu passo o óleo e depois eu me seco. Para não ficar com a pele muito brilhosa também. Aí eu uso o hidratante da Boticário, eu gosto muito do Lys e do Elysée, e uso o Lily também. Por que você gosta desses, Marcely? O perfume deles são surreais. Quando eu passo esse hidratante, eu não tenho necessidade de passar perfume. É o mesmo que eu uso. Entendi, mas qual óleo você usa? Eu uso da linha SPA, o de quinoas. E por que esse óleo? Porque eu acho que isso deu bastante pra minha pele. Hidrata bastante. Eu uso mais óleo no inverno, né? Porque no calor não tem condição. Mas eu vejo que ele não deixa a minha pele dar aquela craquelada Porque se eu não hidratar, começa a dar aquela craquelada, ficar soltando as pelinhas E eu n",radiosa,nao_inferido,nao_inferido,nao_inferido
km_007,pele / corpo / uso / gosto,2,0.7012149095535278,doc_a1d2b9d6eaf7c8a9_pp_ch_0018,doc_a1d2b9d6eaf7c8a9,"E você usa o quê no pé? No pé eu uso hidratante normal, que normalmente eu passo hidratante no corpo, aí quando sobra eu dou uma passada nos pés, mas não é algo muito importante, porque sempre eu tô de sapato, então não é algo que eu uso com muita frequência, que eu preciso necessariamente estar usando. E Andressa, quais são as necessidades e preocupações quando pensa na pele do corpo? Eu já não tenho específico, Só prefiro, às vezes, o óleo no frio mesmo, porque resseca mais. E no calor eu procuro usar o hidratante mesmo, no corpo inteiro. O mesmo que eu uso no rosto, eu uso no corpo, no pé. Você usa o mesmo hidratante no corpo todo? No corpo inteiro. E como que você faz para escolher? Você busca que tem o quê, faz o quê? Então, eu não gosto muito de hidratante muito denso. Então, eu uso o todo de algodão, que é cheirinho mais suave, e é o que eu gosto. Você gosta que a sua pele do corpo fique como? Somente hidratada, não tenho essas miúdas também com cheiro. Quando você fala somente ",radiosa,nao_inferido,nao_inferido,nao_inferido
km_007,pele / corpo / uso / gosto,3,0.6956671476364136,doc_bc29e08f3450ea98_pp_ch_0028,doc_bc29e08f3450ea98,"Porque eu acho ela grossa. Em que sentido? E eu acho que é coisa da minha cabeça, viu, gente? Porque eu fiz uma tatuagem pequenininha esses dias e eu falei assim pra minha prima, faz do outro lado, que esse lado aqui é muito feio. Ela falou assim, mas feio aonde? Grosso aonde? Tipo, coisa que você tá imaginando. Acho que quando eu era muito novinha, eu passava muito gilete e aí aquilo... E as pessoas falando, não pode passar gilete que engrossa o pelo, engrossa a pele. Então, acho que isso ficou ali, assim, eu tenho a impressão de que a minha pele da perna é grossa. E não é a que eu mais gosto. Mas é uma das que eu mais cuido, né? Pele de perna e pele de braço são as que eu mais hidrato, que eu esfolio e tal. Por quê? Não sei, acho que é... Não sei, é automático. Beleza. Vai, meninas! Diana, Eliane, contem vocês sobre essa questão que a gente tava conversando aí da pele, do corpo. Eu costumo cuidar de modo geral de tudo, cuido de pele, de rosto, de corpo, de mãos e pés De modo geral, o",radiosa,nao_inferido,nao_inferido,nao_inferido
km_007,pele / corpo / uso / gosto,4,0.6929730772972107,doc_a1d2b9d6eaf7c8a9_pp_ch_0019,doc_a1d2b9d6eaf7c8a9,"Além de absorver bastante o creme, quando você fala da pele sedosa e visualmente, como que você gosta que a pele do corpo esteja, o visual da pele do corpo? No meu caso, tem manchas de cinzenta, né? Que a gente chama de perna cinzenta. Esbranquiçada, craquelada. Sentar cinzenta, sentar esbranquiçada e craquelada. Quais são as áreas que fica mais esbranquiçada, cinzenta e craquelada, hein? Geralmente o calcanhar. Cotovelo... Eu vou pra Sandra, depois pra Leda, pode ser? Fala aí você, pra gente, quais são as suas necessidades e preocupações pensando na pele do corpo? Hidratar, né? Até porque quando eu mordo no Recife é muito quente. E aí? Meus cotovelo, as pernas que ficam muito ressecadas, meus pés estão rachando, tá entendendo? Então, eu hidrato tudo. O que você usa, Sandra, para hidratar essas partes do corpo? Eu uso hidratante, frutas vermelhas, que eu gosto muito, da Avon. Hidratante, Avon, frutas vermelhas. Por que você gosta muito dele, Sandra? Me conta. Porque ele deixa a minha p",radiosa,nao_inferido,nao_inferido,nao_inferido
km_007,pele / corpo / uso / gosto,5,0.6859256029129028,doc_ecbea0911b71e6fa_pp_ch_0023,doc_ecbea0911b71e6fa,"Entendi, mas você usa também ou não? Daí foi só pra ele mesmo. Eu não tive problema, né? Eu não tenho esse problema com a minha pele assim. Tá, entendi. Mas eu não uso, não. Tá, então me conta, eu vou começar já. Vocês já falaram pouco na nossa conversa, mas aqui às vezes eu sou [NOME], porque eu gosto de, assim, eu sou [NOME]. Então eu quero que cada uma de vocês me conte aí a rotina de cuidados aí com a pele do corpo, tá? O que faz, quando faz, o que usa, pode falar a marca, nome, beleza? Quer começar você, Juliana Oliveira, que já tá aí com o microfone aberto? Eu passo somente o hidratante, somente depois, após o banho mesmo. Eu não tenho muita coisa assim com a pele. Somente mais no frio. No frio eu procuro hidratar mais, porque ela é muito ressecada, a minha perna. Ela resseca ao extremo, de craquelar mesmo. Tá, mas essa hidratação a mais no inverno é passar mais vezes o hidratante, o creme, ou é alguma outra coisa? Não, mais vezes. Tá, e qual produto você usa e por quê? Eu uso o ",radiosa,nao_inferido,nao_inferido,nao_inferido
km_008,fusao / pedido / natura / avon,1,0.6455841660499573,doc_4b466654cd374bdf_pp_ch_0016,doc_4b466654cd374bdf,"Ué, faz tempo isso. Não, eu recebi esses dias. Foi esse boleto da palavra. Agora, eu até comentei com ela. Você vai ter que vasculhar. Já não é a primeira vez que você faz isso. É, também aconteceu comigo já. Boleto antigo e tal. É, entendeu? Aí você fica, poxa vida, agora eu vou ter que vasculhar onde tá esse boleto. Onde que eu paguei, qual o estrago que foi. Entendeu? Agora, e como é que é a relação de vocês com a empresa? Essa coisa do pós-venda é ruim e não tem tanto suporte. Como é isso? Eu ouvi uma coisa do Me Sinto Parte e como é a in natura? Na mão me incomoda a pressão da. Líder de passar pedido e ficar ligando. No meu setor a mudança é de fevereiro. A minha líder da Natura é muito tranquila, mas quando tinha a outra eu ficava com dó dela. Vocês tinham uma líder na tour e uma lídera bom. Pensa por enquanto nessa parte. Não vamos entrar ainda depois da fusão. Eu estava com dó dela, porque às vezes ela me enganava. Ela falava, amiga, você pode me ajudar que eu tenho que bater n",mercato_brasil,nao_inferido,nao_inferido,nao_inferido
km_008,fusao / pedido / natura / avon,2,0.6406619548797607,doc_d9b928d2f9d57ae9_pp_ch_0023,doc_d9b928d2f9d57ae9,"Em 3 dias você pediu no sábado, na quarta estava em casa. Agora eles vêm sem o boleto, pedido cancelado. Mais os pedidos que fiz por Natura, por avô. No meu caso está total. Dá pedido cancelado e acabou. Não vai entregar. Eu fiz ontem do ciclo 19 e estou olhando no aplicativo. Vamos tentar. Atrasa e cancelamento de pedido. Isso. Tanto de produtos Natura, de produtos da Honda, não faz. O meu não está terminado. O meu está terminado. O meu foram as duas. O meu só está atrasado. O meu não está atrasado. O meu já tem nove dias. O meu chegou com três dias. Vamos tentar entender o que a gente tem. O que é a fusão? O que mexeu no negócio de vocês? Porque eu vi que tem negócio assim na administradora. O meu mexeu sim. Eu tinha umas meninas que vendiam para mim. Eu dava comissão para elas da Natura. E elas vendiam só rum. Hoje não. Hoje elas não pedem mais para mim e vendem rum. Mas só que a Natura não vai perder por isso. Porque elas estão pedindo para elas. Só no caso. As suas meninas, que er",mercato_brasil,nao_inferido,nao_inferido,nao_inferido
